Rank,Category,Name,Country,City,Source,Industries,SelfMade,Gender,LastName,FirstName,FinalWorth,BirthDate,Age,birthYear,birthMonth,birthDay,Cpi_Country,Gdp_Country,Life_Expectancy_Country,Tax_Revenue_Country_Country,Total_Tax_Rate_Country,Population_Country,,Current Date1,Fashion & Retail,Bernard Arnault & family,France,Paris,LVMH,Fashion & Retail,FALSE,Male,Arnault,Bernard,211000,3/5/1949,77,1949,3,5,110.05,2715518274227,82.5,24.2,60.7,67059887,,11/25/252,Automotive,Elon Musk,United States,Austin,"Tesla, SpaceX",Automotive,TRUE,Male,Musk,Elon,180000,6/28/1971,54,1971,6,28,117.24,21427700000000,78.5,9.6,36.6,328239523,,11/25/253,Technology,Jeff Bezos,United States,Medina,Amazon,Technology,TRUE,Male,Bezos,Jeff,114000,1/12/1964,62,1964,1,12,117.24,21427700000000,78.5,9.6,36.6,328239523,,11/25/254,Technology,Larry Ellison,United States,Lanai,Oracle,Technology,TRUE,Male,Ellison,Larry,107000,8/17/1944,81,1944,8,17,117.24,21427700000000,78.5,9.6,36.6,328239523,,11/25/255,Finance & Investments,Warren Buffett,United States,Omaha,Berkshire Hathaway,Finance & Investments,TRUE,Male,Buffett,Warren,106000,8/30/1930,95,1930,8,30,117.24,21427700000000,78.5,9.6,36.6,328239523,,11/25/256,Technology,Bill Gates,United States,Medina,Microsoft,Technology,TRUE,Male,Gates,Bill,104000,10/28/1955,70,1955,10,28,117.24,21427700000000,78.5,9.6,36.6,328239523,,11/25/257,Media & Entertainment,Michael Bloomberg,United States,New York,Bloomberg LP,Media & Entertainment,TRUE,Male,Bloomberg,Michael,94500,2/14/1942,84,1942,2,14,117.24,21427700000000,78.5,9.6,36.6,328239523,,11/25/258,Telecom,Carlos Slim Helu & family,Mexico,Mexico City,Telecom,Telecom,TRUE,Male,Slim Helu,Carlos,93000,1/28/1940,86,1940,1,28,141.54,1258286717125,75,13.1,55.1,126014024,,11/25/259,Diversified,Mukesh Ambani,India,Mumbai,Diversified,Diversified,FALSE,Male,Ambani,Mukesh,83400,4/19/1957,69,1957,4,19,180.44,2611000000000,69.4,11.2,49.7,1366417754,,11/25/2510,Technology,Steve Ballmer,United States,Hunts Point,Microsoft,Technology,TRUE,Male,Ballmer,Steve,80700,3/24/1956,70,1956,3,24,117.24,21427700000000,78.5,9.6,36.6,328239523,,11/25/2511,Fashion & Retail,Francoise Bettencourt Meyers & family,France,Paris,L'Oréal,Fashion & Retail,FALSE,Female,Bettencourt Meyers,Francoise,80500,7/10/1953,72,1953,7,10,110.05,2715518274227,82.5,24.2,60.7,67059887,,11/25/2512,Technology,Larry Page,United States,Palo Alto,Google,Technology,TRUE,Male,Page,Larry,79200,3/26/1973,53,1973,3,26,117.24,21427700000000,78.5,9.6,36.6,328239523,,11/25/2513,Fashion & Retail,Amancio Ortega,Spain,La Coruna,Zara,Fashion & Retail,TRUE,Male,Ortega,Amancio,77300,3/28/1936,90,1936,3,28,110.96,1394116310769,83.3,14.2,47,47076781,,11/25/2514,Technology,Sergey Brin,United States,Los Altos,Google,Technology,TRUE,Male,Brin,Sergey,76000,8/21/1973,52,1973,8,21,117.24,21427700000000,78.5,9.6,36.6,328239523,,11/25/2515,Food & Beverage,Zhong Shanshan,China,Hangzhou,"Beverages, pharmaceuticals",Food & Beverage,TRUE,Male,Zhong,Shanshan,68000,12/1/1954,71,1954,12,1,125.08,19910000000000,77,9.4,59.2,1397715000,,11/25/2516,Technology,Mark Zuckerberg,United States,Palo Alto,Facebook,Technology,TRUE,Male,Zuckerberg,Mark,64400,5/14/1984,42,1984,5,14,117.24,21427700000000,78.5,9.6,36.6,328239523,,11/25/2517,Diversified,Charles Koch & family,United States,Wichita,Koch Industries,Diversified,FALSE,Male,Koch,Charles,59000,11/1/1935,90,1935,11,1,117.24,21427700000000,78.5,9.6,36.6,328239523,,11/25/2517,Diversified,Julia Koch & family,United States,New York,Koch Industries,Diversified,FALSE,Female,Koch,Julia,59000,4/12/1962,64,1962,4,12,117.24,21427700000000,78.5,9.6,36.6,328239523,,11/25/2519,Fashion & Retail,Jim Walton,United States,Bentonville,Walmart,Fashion & Retail,FALSE,Male,Walton,Jim,58800,6/7/1948,77,1948,6,7,117.24,21427700000000,78.5,9.6,36.6,328239523,,11/25/2520,Fashion & Retail,Rob Walton & family,United States,Bentonville,Walmart,Fashion & Retail,FALSE,Male,Walton,Rob,57600,10/27/1944,81,1944,10,27,117.24,21427700000000,78.5,9.6,36.6,328239523,,11/25/2521,Fashion & Retail,Alice Walton,United States,Fort Worth,Walmart,Fashion & Retail,FALSE,Female,Walton,Alice,56700,10/7/1949,76,1949,10,7,117.24,21427700000000,78.5,9.6,36.6,328239523,,11/25/2522,Media & Entertainment,David Thomson & family,Canada,Toronto,Media,Media & Entertainment,FALSE,Male,Thomson,David,54400,6/12/1957,68,1957,6,12,116.76,1736425629520,81.9,12.8,24.5,36991981,,11/25/2523,Technology,Michael Dell,United States,Austin,Dell Technologies,Technology,TRUE,Male,Dell,Michael,50100,2/23/1965,61,1965,2,23,117.24,21427700000000,78.5,9.6,36.6,328239523,,11/25/2524,Diversified,Gautam Adani,India,Ahmedabad,"Infrastructure, commodities",Diversified,TRUE,Male,Adani,Gautam,47200,6/24/1962,63,1962,6,24,180.44,2611000000000,69.4,11.2,49.7,1366417754,,11/25/2525,Fashion & Retail,Phil Knight & family,United States,Hillsboro,Nike,Fashion & Retail,TRUE,Male,Knight,Phil,45100,2/24/1938,88,1938,2,24,117.24,21427700000000,78.5,9.6,36.6,328239523,,11/25/2526,Technology,Zhang Yiming,China,Beijing,TikTok,Technology,TRUE,Male,Zhang,Yiming,45000,1/1/1984,42,1984,1,1,125.08,19910000000000,77,9.4,59.2,1397715000,,11/25/2527,Fashion & Retail,Dieter Schwarz,Germany,Neckarsulm,Retail,Fashion & Retail,FALSE,Male,Schwarz,Dieter,42900,9/24/1939,86,1939,9,24,112.85,3845630030824,80.9,11.5,48.8,83132799,,11/25/2528,Fashion & Retail,François Pinault & family,France,Paris,Luxury goods,Fashion & Retail,TRUE,Male,Pinault,François,40100,8/21/1936,89,1936,8,21,110.05,2715518274227,82.5,24.2,60.7,67059887,,11/25/2529,Logistics,Klaus-Michael Kuehne,Switzerland,Schindellegi,Shipping,Logistics,FALSE,Male,Kuehne,Klaus-Michael,39100,6/2/1937,88,1937,6,2,99.55,703082435360,83.6,10.1,28.8,8574832,,11/25/2530,Food & Beverage,Giovanni Ferrero,Belgium,Brussels,"Nutella, chocolates",Food & Beverage,FALSE,Male,Ferrero,Giovanni,38900,9/21/1964,61,1964,9,21,117.11,529606710418,81.6,24,55.4,11484055,,11/25/2531,Food & Beverage,Jacqueline Mars,United States,The Plains,"Candy, pet food",Food & Beverage,FALSE,Female,Mars,Jacqueline,38300,10/10/1939,86,1939,10,10,117.24,21427700000000,78.5,9.6,36.6,328239523,,11/25/2531,Food & Beverage,John Mars,United States,Jackson,"Candy, pet food",Food & Beverage,FALSE,Male,Mars,John,38300,10/15/1935,90,1935,10,15,117.24,21427700000000,78.5,9.6,36.6,328239523,,11/25/2534,Technology,Ma Huateng,China,Shenzhen,Internet media,Technology,TRUE,Male,Ma,Huateng,35300,10/29/1971,54,1971,10,29,125.08,19910000000000,77,9.4,59.2,1397715000,,11/25/2535,Gambling & Casinos,Miriam Adelson & family,United States,Las Vegas,Casinos,Gambling & Casinos,FALSE,Female,Adelson,Miriam,35000,10/10/1945,80,1945,10,10,117.24,21427700000000,78.5,9.6,36.6,328239523,,11/25/2535,Finance & Investments,Ken Griffin,United States,Miami,Hedge funds,Finance & Investments,TRUE,Male,Griffin,Ken,35000,10/15/1968,57,1968,10,15,117.24,21427700000000,78.5,9.6,36.6,328239523,,11/25/2537,Food & Beverage,Mark Mateschitz,Austria,Salzburg,Red Bull,Food & Beverage,FALSE,Male,Mateschitz,Mark,34700,5/7/1992,34,1992,5,7,118.06,446314739528,81.6,25.4,51.4,8877067,,11/25/2538,Automotive,Robin Zeng,China,Ningde,Batteries,Automotive,TRUE,Male,Zeng,Robin,33400,1/1/1969,57,1969,1,1,125.08,19910000000000,77,9.4,59.2,1397715000,,11/25/2539,Fashion & Retail,Tadashi Yanai & family,Japan,Tokyo,Fashion retail,Fashion & Retail,TRUE,Male,Yanai,Tadashi,32600,2/7/1949,77,1949,2,7,105.48,5081769542380,84.2,11.9,46.7,126226568,,11/25/2540,Diversified,Len Blavatnik,United Kingdom,London,"Music, chemicals",Diversified,TRUE,Male,Blavatnik,Len,32100,6/1/1957,68,1957,6,1,119.62,2827113184696,81.3,25.5,30.6,66834405,,11/25/2541,Fashion & Retail,Alain Wertheimer,United States,New York,Chanel,Fashion & Retail,FALSE,Male,Wertheimer,Alain,31600,8/28/1948,77,1948,8,28,117.24,21427700000000,78.5,9.6,36.6,328239523,,11/25/2541,Fashion & Retail,Gerard Wertheimer,United States,New York,Chanel,Fashion & Retail,FALSE,Male,Wertheimer,Gerard,31600,1/9/1951,75,1951,1,9,117.24,21427700000000,78.5,9.6,36.6,328239523,,11/25/2543,Logistics,Gianluigi Aponte,Switzerland,Geneva,Shipping,Logistics,TRUE,Male,Aponte,Gianluigi,31200,6/27/1940,85,1940,6,27,99.55,703082435360,83.6,10.1,28.8,8574832,,11/25/2543,Logistics,Rafaela Aponte-Diamant,Switzerland,Geneva,Shipping,Logistics,TRUE,Female,Aponte-Diamant,Rafaela,31200,3/26/1945,81,1945,3,26,99.55,703082435360,83.6,10.1,28.8,8574832,,11/25/2545,Technology,Colin Zheng Huang,China,Shanghai,E-commerce,Technology,TRUE,Male,Huang,Colin Zheng,30200,2/2/1980,46,1980,2,2,125.08,19910000000000,77,9.4,59.2,1397715000,,11/25/2546,Manufacturing,Reinhold Wuerth & family,Germany,Kuenzelsau,Fasteners,Manufacturing,TRUE,Male,Wuerth,Reinhold,29700,4/20/1935,91,1935,4,20,112.85,3845630030824,80.9,11.5,48.8,83132799,,11/25/2548,Finance & Investments,Jeff Yass,United States,Haverford,"Trading, investments",Finance & Investments,TRUE,Male,Yass,Jeff,28500,7/17/1958,67,1958,7,17,117.24,21427700000000,78.5,9.6,36.6,328239523,,11/25/2549,Finance & Investments,Jim Simons,United States,East Setauket,Hedge funds,Finance & Investments,TRUE,Male,Simons,Jim,28100,4/25/1938,88,1938,4,25,117.24,21427700000000,78.5,9.6,36.6,328239523,,11/25/2550,Finance & Investments,Stephen Schwarzman,United States,New York,Investments,Finance & Investments,TRUE,Male,Schwarzman,Stephen,27800,2/14/1947,79,1947,2,14,117.24,21427700000000,78.5,9.6,36.6,328239523,,11/25/2551,Automotive,Susanne Klatten,Germany,Bad Homburg,"BMW, pharmaceuticals",Automotive,FALSE,Female,Klatten,Susanne,27400,4/28/1962,64,1962,4,28,112.85,3845630030824,80.9,11.5,48.8,83132799,,11/25/2552,Metals & Mining,Gina Rinehart,Australia,Perth,Mining,Metals & Mining,FALSE,Female,Rinehart,Gina,27000,2/9/1954,72,1954,2,9,119.8,1392680589329,82.7,23,47.4,25766605,,11/25/2553,Technology,William Ding,China,Hangzhou,Online games,Technology,TRUE,Male,Ding,William,26700,10/1/1971,54,1971,10,1,125.08,19910000000000,77,9.4,59.2,1397715000,,11/25/2554,Metals & Mining,Germán Larrea Mota Velasco & family,Mexico,Mexico City,Mining,Metals & Mining,FALSE,Male,Larrea Mota Velasco,Germán,26600,10/26/1953,72,1953,10,26,141.54,1258286717125,75,13.1,55.1,126014024,,11/25/2555,Technology,Shiv Nadar,India,Delhi,software services,Technology,TRUE,Male,Nadar,Shiv,25600,7/18/1945,80,1945,7,18,180.44,2611000000000,69.4,11.2,49.7,1366417754,,11/25/2556,Energy,Low Tuck Kwong,Indonesia,Jakarta,Coal,Energy,TRUE,Male,Low Tuck,Kwong,25500,4/17/1948,78,1948,4,17,151.18,1119190780753,71.5,10.2,30.1,270203917,,11/25/2557,Finance & Investments,Thomas Peterffy,United States,Palm Beach,Discount brokerage,Finance & Investments,TRUE,Male,Peterffy,Thomas,25300,9/30/1944,81,1944,9,30,117.24,21427700000000,78.5,9.6,36.6,328239523,,11/25/2558,Metals & Mining,Andrey Melnichenko & family,United Arab Emirates,Ras Al Khaimah,"Fertilizers, coal",Metals & Mining,TRUE,Male,Melnichenko,Andrey,25200,3/8/1972,54,1972,3,8,114.52,421142267938,77.8,0.1,15.9,9770529,,11/25/2559,Automotive,Stefan Quandt,Germany,Frankfurt,BMW,Automotive,FALSE,Male,Quandt,Stefan,24600,5/9/1966,60,1966,5,9,112.85,3845630030824,80.9,11.5,48.8,83132799,,11/25/2560,Technology,MacKenzie Scott,United States,Seattle,Amazon,Technology,FALSE,Female,Scott,MacKenzie,24400,4/7/1970,56,1970,4,7,117.24,21427700000000,78.5,9.6,36.6,328239523,,11/25/2561,Finance & Investments,R. Budi Hartono,Indonesia,Kudus,"Banking, tobacco",Finance & Investments,FALSE,Male,Hartono,R. Budi,24200,1/1/1941,85,1941,1,1,151.18,1119190780753,71.5,10.2,30.1,270203917,,11/25/2562,Metals & Mining,Vladimir Potanin,Russia,Moscow,Metals,Metals & Mining,TRUE,Male,Potanin,Vladimir,23700,1/3/1961,65,1961,1,3,180.75,1699876578871,72.7,11.4,46.2,144373535,,11/25/2563,Technology,Jack Ma,China,Hangzhou,E-commerce,Technology,TRUE,Male,Ma,Jack,23500,9/10/1964,61,1964,9,10,125.08,19910000000000,77,9.4,59.2,1397715000,,11/25/2564,Manufacturing,He Xiangjian & family,China,Foshan,Home appliances,Manufacturing,TRUE,Male,He,Xiangjian,23400,8/11/1942,83,1942,8,11,125.08,19910000000000,77,9.4,59.2,1397715000,,11/25/2565,Metals & Mining,Iris Fontbona & family,Chile,Santiago,Mining,Metals & Mining,FALSE,Female,Fontbona,Iris,23100,1/1/1943,83,1943,1,1,131.91,282318159745,80,18.2,34,18952038,,11/25/2565,Manufacturing,Michael Hartono,Indonesia,Kudus,"Banking, tobacco",Manufacturing,FALSE,Male,Hartono,Michael,23100,10/2/1939,86,1939,10,2,151.18,1119190780753,71.5,10.2,30.1,270203917,,11/25/2567,Manufacturing,James Ratcliffe,United Kingdom,London,Chemicals,Manufacturing,TRUE,Male,Ratcliffe,James,22900,1/1/1953,73,1953,1,1,119.62,2827113184696,81.3,25.5,30.6,66834405,,11/25/2568,Healthcare,Cyrus Poonawalla,India,Pune,Vaccines,Healthcare,FALSE,Male,Poonawalla,Cyrus,22600,5/11/1941,85,1941,5,11,180.44,2611000000000,69.4,11.2,49.7,1366417754,,11/25/2569,Telecom,Masayoshi Son,Japan,Tokyo,"Internet, telecom",Telecom,TRUE,Male,Son,Masayoshi,22400,8/11/1957,68,1957,8,11,105.48,5081769542380,84.2,11.9,46.7,126226568,,11/25/2570,Metals & Mining,Vladimir Lisin,Russia,Moscow,"Steel, transport",Metals & Mining,TRUE,Male,Lisin,Vladimir,22100,5/7/1956,70,1956,5,7,180.75,1699876578871,72.7,11.4,46.2,144373535,,11/25/2571,Food & Beverage,Emmanuel Besnier,France,Laval,Cheese,Food & Beverage,FALSE,Male,Besnier,Emmanuel,22000,9/18/1970,55,1970,9,18,110.05,2715518274227,82.5,24.2,60.7,67059887,,11/25/2572,Finance & Investments,Abigail Johnson,United States,Milton,Fidelity,Finance & Investments,FALSE,Female,Johnson,Abigail,21600,12/19/1961,64,1961,12,19,117.24,21427700000000,78.5,9.6,36.6,328239523,,11/25/2572,Energy,Leonid Mikhelson & family,Russia,Moscow,"Gas, chemicals",Energy,TRUE,Male,Mikhelson,Leonid,21600,8/11/1955,70,1955,8,11,180.75,1699876578871,72.7,11.4,46.2,144373535,,11/25/2574,Fashion & Retail,Lukas Walton,United States,Chicago,Walmart,Fashion & Retail,FALSE,Male,Walton,Lukas,21200,9/19/1986,39,1986,9,19,117.24,21427700000000,78.5,9.6,36.6,328239523,,11/25/2574,Service,Wang Wei,China,Shenzhen,Package delivery,Service,TRUE,Male,Wang,Wei,21200,10/1/1970,55,1970,10,1,125.08,19910000000000,77,9.4,59.2,1397715000,,11/25/2576,Technology,Jensen Huang,United States,Los Altos,Semiconductors,Technology,TRUE,Male,Huang,Jensen,21100,2/17/1963,63,1963,2,17,117.24,21427700000000,78.5,9.6,36.6,328239523,,11/25/2577,Fashion & Retail,Leonard Lauder,United States,New York,Estee Lauder,Fashion & Retail,FALSE,Male,Lauder,Leonard,21000,3/19/1933,93,1933,3,19,117.24,21427700000000,78.5,9.6,36.6,328239523,,11/25/2577,Manufacturing,Takemitsu Takizaki,Japan,Osaka,Sensors,Manufacturing,TRUE,Male,Takizaki,Takemitsu,21000,6/10/1945,80,1945,6,10,105.48,5081769542380,84.2,11.9,46.7,126226568,,11/25/2579,Metals & Mining,Alexey Mordashov & family,Russia,Moscow,"Steel, investments",Metals & Mining,TRUE,Male,Mordashov,Alexey,20900,9/26/1965,60,1965,9,26,180.75,1699876578871,72.7,11.4,46.2,144373535,,11/25/2580,Energy,Vagit Alekperov,Russia,Moscow,Oil,Energy,TRUE,Male,Alekperov,Vagit,20500,9/1/1950,75,1950,9,1,180.75,1699876578871,72.7,11.4,46.2,144373535,,11/25/2581,Healthcare,"Thomas Frist, Jr. & family",United States,Nashville,Hospitals,Healthcare,TRUE,Male,Frist,Thomas,20200,8/12/1938,87,1938,8,12,117.24,21427700000000,78.5,9.6,36.6,328239523,,11/25/2582,Metals & Mining,Andrew Forrest,Australia,Perth,Mining,Metals & Mining,TRUE,Male,Forrest,Andrew,19600,11/18/1961,64,1961,11,18,119.8,1392680589329,82.7,23,47.4,25766605,,11/25/2583,Finance & Investments,Ray Dalio,United States,Greenwich,Hedge funds,Finance & Investments,TRUE,Male,Dalio,Ray,19100,8/8/1949,76,1949,8,8,117.24,21427700000000,78.5,9.6,36.6,328239523,,11/25/2584,Automotive,Eric Li,China,Hangzhou,Automobiles,Automotive,TRUE,Male,Li,Eric,19000,6/1/1963,62,1963,6,1,125.08,19910000000000,77,9.4,59.2,1397715000,,11/25/2584,Metals & Mining,Wang Wenyin,China,Shenzhen,"Mining, copper products",Metals & Mining,TRUE,Male,Wang,Wenyin,19000,3/1/1968,58,1968,3,1,125.08,19910000000000,77,9.4,59.2,1397715000,,11/25/2586,Food & Beverage,Qin Yinglin,China,Nanyang,Pig breeding,Food & Beverage,TRUE,Male,Qin,Yinglin,18900,4/17/1965,61,1965,4,17,125.08,19910000000000,77,9.4,59.2,1397715000,,11/25/2588,Automotive,Wang Chuanfu,China,Shenzhen,"Batteries, automobiles",Automotive,TRUE,Male,Wang,Chuanfu,18700,2/15/1966,60,1966,2,15,125.08,19910000000000,77,9.4,59.2,1397715000,,11/25/2589,Energy,Harold Hamm & family,United States,Oklahoma City,Oil & gas,Energy,TRUE,Male,Hamm,Harold,18500,12/11/1945,80,1945,12,11,117.24,21427700000000,78.5,9.6,36.6,328239523,,11/25/2589,Finance & Investments,David Tepper,United States,Palm Beach,Hedge funds,Finance & Investments,TRUE,Male,Tepper,David,18500,9/11/1957,68,1957,9,11,117.24,21427700000000,78.5,9.6,36.6,328239523,,11/25/2589,Energy,Gennady Timchenko,Russia,Moscow,"Oil, gas",Energy,TRUE,Male,Timchenko,Gennady,18500,11/9/1952,73,1952,11,9,180.75,1699876578871,72.7,11.4,46.2,144373535,,11/25/2592,Finance & Investments,Daniel Gilbert,United States,Franklin,Quicken Loans,Finance & Investments,TRUE,Male,Gilbert,Daniel,18000,1/17/1962,64,1962,1,17,117.24,21427700000000,78.5,9.6,36.6,328239523,,11/25/2593,Metals & Mining,Lakshmi Mittal,United Kingdom,London,Steel,Metals & Mining,FALSE,Male,Mittal,Lakshmi,17700,6/15/1950,75,1950,6,15,119.62,2827113184696,81.3,25.5,30.6,66834405,,11/25/2594,Finance & Investments,Steve Cohen,United States,Greenwich,Hedge funds,Finance & Investments,TRUE,Male,Cohen,Steve,17500,6/11/1956,69,1956,6,11,117.24,21427700000000,78.5,9.6,36.6,328239523,,11/25/2594,Finance & Investments,Carl Icahn,United States,Indian Creek,Investments,Finance & Investments,TRUE,Male,Icahn,Carl,17500,2/16/1936,90,1936,2,16,117.24,21427700000000,78.5,9.6,36.6,328239523,,11/25/2594,Metals & Mining,Savitri Jindal & family,India,Hisar,Steel,Metals & Mining,FALSE,Female,Jindal,Savitri,17500,3/20/1950,76,1950,3,20,180.44,2611000000000,69.4,11.2,49.7,1366417754,,11/25/2597,Real Estate,Donald Bren,United States,Newport Beach,Real estate,Real Estate,TRUE,Male,Bren,Donald,17400,5/11/1932,94,1932,5,11,117.24,21427700000000,78.5,9.6,36.6,328239523,,11/25/2597,Fashion & Retail,"John Menard, Jr.",United States,Eau Claire,Home improvement stores,Fashion & Retail,TRUE,Male,Menard,John,17400,1/22/1940,86,1940,1,22,117.24,21427700000000,78.5,9.6,36.6,328239523,,11/25/2599,Media & Entertainment,Rupert Murdoch & family,United States,New York,"Newspapers, TV network",Media & Entertainment,FALSE,Male,Murdoch,Rupert,17100,3/11/1931,95,1931,3,11,117.24,21427700000000,78.5,9.6,36.6,328239523,,11/25/25100,Finance & Investments,Vicky Safra & family,Switzerland,Crans-Montana,Banking,Finance & Investments,FALSE,Female,Safra,Vicky,16700,1/1/1953,73,1953,1,1,99.55,703082435360,83.6,10.1,28.8,8574832,,11/25/25101,Fashion & Retail,"Theo Albrecht, Jr. & family",Germany,Mulheim an der Ruhr,"Aldi, Trader Joe's",Fashion & Retail,FALSE,Male,Albrecht,Theo,16500,1/1/1951,75,1951,1,1,112.85,3845630030824,80.9,11.5,48.8,83132799,,11/25/25101,Finance & Investments,Renata Kellnerova & family,Czech Republic,Prague,"Finance, telecommunications",Finance & Investments,FALSE,Female,Kellnerova,Renata,16500,7/4/1967,58,1967,7,4,116.48,246489245495,79,14.9,46.1,10669709,,11/25/25103,Healthcare,Li Xiting,China,Shenzhen,medical devices,Healthcare,TRUE,Male,Li,Xiting,16300,1/1/1951,75,1951,1,1,125.08,19910000000000,77,9.4,59.2,1397715000,,11/25/25104,Fashion & Retail,Stefan Persson,Sweden,Stockholm,H&M,Fashion & Retail,FALSE,Male,Persson,Stefan,16200,10/4/1947,78,1947,10,4,110.51,530832908738,82.5,27.9,49.1,10285453,,11/25/25104,Technology,Eric Schmidt,United States,Atherton,Google,Technology,TRUE,Male,Schmidt,Eric,16200,4/27/1955,71,1955,4,27,117.24,21427700000000,78.5,9.6,36.6,328239523,,11/25/25106,Finance & Investments,Michael Platt,Switzerland,Geneva,Hedge funds,Finance & Investments,TRUE,Male,Platt,Michael,16000,3/18/1968,58,1968,3,18,99.55,703082435360,83.6,10.1,28.8,8574832,,11/25/25107,Food & Beverage,Pang Kang,China,Foshan,Soy sauce,Food & Beverage,TRUE,Male,Pang,Kang,15900,1/19/1956,70,1956,1,19,125.08,19910000000000,77,9.4,59.2,1397715000,,11/25/25108,Food & Beverage,Jorge Paulo Lemann & family,Switzerland,Zurich,Beer,Food & Beverage,TRUE,Male,Lemann,Jorge Paulo,15800,8/26/1939,86,1939,8,26,99.55,703082435360,83.6,10.1,28.8,8574832,,11/25/25112,Healthcare,Dilip Shanghvi,India,Mumbai,Pharmaceuticals,Healthcare,TRUE,Male,Shanghvi,Dilip,15600,10/1/1955,70,1955,10,1,180.44,2611000000000,69.4,11.2,49.7,1366417754,,11/25/25113,Technology,Robert Pera,United States,San Jose,Wireless networking,Technology,TRUE,Male,Pera,Robert,15500,3/10/1978,48,1978,3,10,117.24,21427700000000,78.5,9.6,36.6,328239523,,11/25/25114,Fashion & Retail,Radhakishan Damani,India,Mumbai,"Retail, investments",Fashion & Retail,TRUE,Male,Damani,Radhakishan,15300,1/1/1955,71,1955,1,1,180.44,2611000000000,69.4,11.2,49.7,1366417754,,11/25/25115,Automotive,Huang Shilin,China,Ningde,Batteries,Automotive,TRUE,Male,Huang,Shilin,15200,1/1/1967,59,1967,1,1,125.08,19910000000000,77,9.4,59.2,1397715000,,11/25/25116,Diversified,Dhanin Chearavanont,Thailand,Bangkok,Diversified,Diversified,FALSE,Male,Chearavanont,Dhanin,14900,4/19/1939,87,1939,4,19,113.27,543649976166,76.9,14.9,29.5,69625582,,11/25/25116,Fashion & Retail,David Green & family,United States,Oklahoma City,Retail,Fashion & Retail,TRUE,Male,Green,David,14900,11/13/1941,84,1941,11,13,117.24,21427700000000,78.5,9.6,36.6,328239523,,11/25/25118,Food & Beverage,Charoen Sirivadhanabhakdi,Thailand,Bangkok,"Alcohol, real estate",Food & Beverage,TRUE,Male,Sirivadhanabhakdi,Charoen,14800,5/2/1944,82,1944,5,2,113.27,543649976166,76.9,14.9,29.5,69625582,,11/25/25119,Food & Beverage,Charlene de Carvalho-Heineken & family,United Kingdom,London,Heineken,Food & Beverage,FALSE,Female,de Carvalho-Heineken,Charlene,14700,6/30/1954,71,1954,6,30,119.62,2827113184696,81.3,25.5,30.6,66834405,,11/25/25120,Healthcare,Xu Hang,China,Shenzhen,Medical devices,Healthcare,TRUE,Male,Xu,Hang,14600,5/22/1962,64,1962,5,22,125.08,19910000000000,77,9.4,59.2,1397715000,,11/25/25121,Automotive,Wei Jianjun & family,China,Baoding,Automobiles,Automotive,TRUE,Male,Wei,Jianjun,14500,3/1/1964,62,1964,3,1,125.08,19910000000000,77,9.4,59.2,1397715000,,11/25/25123,Manufacturing,Goh Cheng Liang,Singapore,Singapore,Paints,Manufacturing,TRUE,Male,Goh,Cheng Liang,14300,6/27/1927,98,1927,6,27,114.41,372062527489,83.1,13.1,21,5703569,,11/25/25124,Diversified,Kumar Birla,India,Mumbai,Commodities,Diversified,FALSE,Male,Birla,Kumar,14200,6/14/1967,58,1967,6,14,180.44,2611000000000,69.4,11.2,49.7,1366417754,,11/25/25124,Manufacturing,Aliko Dangote,Nigeria,Lagos,"Cement, sugar",Manufacturing,TRUE,Male,Dangote,Aliko,14200,4/10/1957,69,1957,4,10,267.51,448120428859,54.3,1.5,34.8,200963599,,11/25/25127,Diversified,Idan Ofer,United Kingdom,London,Shipping,Diversified,FALSE,Male,Ofer,Idan,14000,10/2/1955,70,1955,10,2,119.62,2827113184696,81.3,25.5,30.6,66834405,,11/25/25128,Healthcare,Chen Bang,China,Changsha,Hospitals,Healthcare,TRUE,Male,Chen,Bang,13900,9/1/1965,60,1965,9,1,125.08,19910000000000,77,9.4,59.2,1397715000,,11/25/25130,Logistics,John Fredriksen,United Kingdom,London,Shipping,Logistics,TRUE,Male,Fredriksen,John,13700,2/1/1945,81,1945,2,1,119.62,2827113184696,81.3,25.5,30.6,66834405,,11/25/25130,Construction & Engineering,Diane Hendricks,United States,Afton,Building supplies,Construction & Engineering,TRUE,Female,Hendricks,Diane,13700,3/2/1947,79,1947,3,2,117.24,21427700000000,78.5,9.6,36.6,328239523,,11/25/25130,Technology,Jan Koum,United States,Atherton,WhatsApp,Technology,TRUE,Male,Koum,Jan,13700,2/24/1976,50,1976,2,24,117.24,21427700000000,78.5,9.6,36.6,328239523,,11/25/25133,Sports,Jerry Jones,United States,Dallas,Dallas Cowboys,Sports,TRUE,Male,Jones,Jerry,13300,10/13/1942,83,1942,10,13,117.24,21427700000000,78.5,9.6,36.6,328239523,,11/25/25133,Energy,George Kaiser,United States,Tulsa,"Oil & gas, banking",Energy,FALSE,Male,Kaiser,George,13300,7/29/1942,83,1942,7,29,117.24,21427700000000,78.5,9.6,36.6,328239523,,11/25/25136,Automotive,Lu Xiangyang,China,Guangzhou,"Automobiles, batteries",Automotive,TRUE,Male,Lu,Xiangyang,13200,12/28/1962,63,1962,12,28,125.08,19910000000000,77,9.4,59.2,1397715000,,11/25/25137,Real Estate,Harry Triguboff,Australia,Sydney,Real estate,Real Estate,TRUE,Male,Triguboff,Harry,13100,3/3/1933,93,1933,3,3,119.8,1392680589329,82.7,23,47.4,25766605,,11/25/25138,Finance & Investments,Uday Kotak,India,Mumbai,Banking,Finance & Investments,TRUE,Male,Kotak,Uday,12900,3/15/1959,67,1959,3,15,180.44,2611000000000,69.4,11.2,49.7,1366417754,,11/25/25138,Sports,Stanley Kroenke,United States,Electra,"Sports, real estate",Sports,TRUE,Male,Kroenke,Stanley,12900,7/29/1947,78,1947,7,29,117.24,21427700000000,78.5,9.6,36.6,328239523,,11/25/25140,Energy,Mikhail Fridman,United Kingdom,London,"Oil, banking, telecom",Energy,TRUE,Male,Fridman,Mikhail,12600,4/21/1964,62,1964,4,21,119.62,2827113184696,81.3,25.5,30.6,66834405,,11/25/25141,Energy,Sarath Ratanavadi,Thailand,Bangkok,Energy,Energy,TRUE,Male,Ratanavadi,Sarath,12300,7/12/1965,60,1965,7,12,113.27,543649976166,76.9,14.9,29.5,69625582,,11/25/25142,Metals & Mining,Dang Yanbao,China,Yinchuan,Coal,Metals & Mining,TRUE,Male,Dang,Yanbao,12200,2/1/1973,53,1973,2,1,125.08,19910000000000,77,9.4,59.2,1397715000,,11/25/25142,Healthcare,Jiang Rensheng & family,China,Chongqing,Vaccines,Healthcare,TRUE,Male,Jiang,Rensheng,12200,10/8/1953,72,1953,10,8,125.08,19910000000000,77,9.4,59.2,1397715000,,11/25/25144,Automotive,Shahid Khan,United States,Naples,Auto parts,Automotive,TRUE,Male,Khan,Shahid,12100,7/18/1950,75,1950,7,18,117.24,21427700000000,78.5,9.6,36.6,328239523,,11/25/25145,Technology,Laurene Powell Jobs & family,United States,Palo Alto,"Apple, Disney",Technology,FALSE,Female,Powell Jobs,Laurene,12000,11/6/1963,62,1963,11,6,117.24,21427700000000,78.5,9.6,36.6,328239523,,11/25/25147,Real Estate,Stephen Ross,United States,New York,Real estate,Real Estate,TRUE,Male,Ross,Stephen,11600,5/10/1940,86,1940,5,10,117.24,21427700000000,78.5,9.6,36.6,328239523,,11/25/25148,Technology,Pavel Durov,United Arab Emirates,Dubai,Messaging app,Technology,TRUE,Male,Durov,Pavel,11500,10/10/1984,41,1984,10,10,114.52,421142267938,77.8,0.1,15.9,9770529,,11/25/25148,Healthcare,Andreas Struengmann & family,Germany,Tegernsee,Pharmaceuticals,Healthcare,TRUE,Male,Struengmann,Andreas,11500,2/16/1950,76,1950,2,16,112.85,3845630030824,80.9,11.5,48.8,83132799,,11/25/25148,Healthcare,Thomas Struengmann & family,Germany,Tegernsee,Pharmaceuticals,Healthcare,TRUE,Male,Struengmann,Thomas,11500,2/16/1950,76,1950,2,16,112.85,3845630030824,80.9,11.5,48.8,83132799,,11/25/25151,Food & Beverage,Liu Hanyuan,China,Chengdu,Agribusiness,Food & Beverage,TRUE,Male,Liu,Hanyuan,11400,1/1/1964,62,1964,1,1,125.08,19910000000000,77,9.4,59.2,1397715000,,11/25/25151,Fashion & Retail,Michael Rubin,United States,Bryn Mawr,Online retail,Fashion & Retail,TRUE,Male,Rubin,Michael,11400,7/21/1972,53,1972,7,21,117.24,21427700000000,78.5,9.6,36.6,328239523,,11/25/25153,Finance & Investments,Israel Englander,United States,New York,Hedge funds,Finance & Investments,TRUE,Male,Englander,Israel,11300,9/30/1948,77,1948,9,30,117.24,21427700000000,78.5,9.6,36.6,328239523,,11/25/25153,Manufacturing,Viatcheslav Kantor,Israel,Herzliya,"Fertilizer, real estate",Manufacturing,TRUE,Male,Kantor,Viatcheslav,11300,9/8/1953,72,1953,9,8,108.15,395098666122,82.8,23.1,25.3,9053300,,11/25/25153,Manufacturing,Anthony Pratt,Australia,Melbourne,Manufacturing,Manufacturing,FALSE,Male,Pratt,Anthony,11300,4/11/1960,66,1960,4,11,119.8,1392680589329,82.7,23,47.4,25766605,,11/25/25153,Finance & Investments,Mikhail Prokhorov,Switzerland,Frauenfeld,Investments,Finance & Investments,TRUE,Male,Prokhorov,Mikhail,11300,5/3/1965,61,1965,5,3,99.55,703082435360,83.6,10.1,28.8,8574832,,11/25/25157,Fashion & Retail,Giorgio Armani,Italy,Milan,Luxury goods,Fashion & Retail,TRUE,Male,Armani,Giorgio,11100,7/11/1934,91,1934,7,11,110.62,2001244392042,82.9,24.3,59.1,60297396,,11/25/25157,Fashion & Retail,Johann Rupert & family,South Africa,Cape Town,Luxury goods,Fashion & Retail,FALSE,Male,Rupert,Johann,11100,6/1/1950,75,1950,6,1,158.93,351431649241,63.9,27.5,29.2,58558270,,11/25/25159,Technology,Zhang Zhidong,China,Shenzhen,Internet media,Technology,TRUE,Male,Zhang,Zhidong,11000,1/1/1972,54,1972,1,1,125.08,19910000000000,77,9.4,59.2,1397715000,,11/25/25161,Finance & Investments,Philip Anschutz,United States,Denver,"Energy, sports, entertainment",Finance & Investments,FALSE,Male,Anschutz,Philip,10900,12/28/1939,86,1939,12,28,117.24,21427700000000,78.5,9.6,36.6,328239523,,11/25/25161,Fashion & Retail,Judy Love & family,United States,Oklahoma City,Gas stations,Fashion & Retail,TRUE,Female,Love,Judy,10900,6/17/1937,88,1937,6,17,117.24,21427700000000,78.5,9.6,36.6,328239523,,11/25/25161,Fashion & Retail,Ricardo Salinas Pliego & family,Mexico,Mexico City,"Retail, media",Fashion & Retail,FALSE,Male,Salinas Pliego,Ricardo,10900,10/19/1955,70,1955,10,19,141.54,1258286717125,75,13.1,55.1,126014024,,11/25/25164,Media & Entertainment,Donald Newhouse,United States,New York,Media,Media & Entertainment,FALSE,Male,Newhouse,Donald,10700,8/5/1929,96,1929,8,5,117.24,21427700000000,78.5,9.6,36.6,328239523,,11/25/25165,Sports,Robert Kraft,United States,Brookline,"Manufacturing, New England Patriots",Sports,TRUE,Male,Kraft,Robert,10600,6/5/1941,84,1941,6,5,117.24,21427700000000,78.5,9.6,36.6,328239523,,11/25/25165,Food & Beverage,Marcel Herrmann Telles,Brazil,Sao Paulo,Beer,Food & Beverage,TRUE,Male,Telles,Marcel Herrmann,10600,1/1/1950,76,1950,1,1,167.4,1839758040766,75.7,14.2,65.1,212559417,,11/25/25167,Finance & Investments,Suleiman Kerimov & family,Russia,Moscow,Gold,Finance & Investments,TRUE,Male,Kerimov & family,Suleiman,10500,3/12/1966,60,1966,3,12,180.75,1699876578871,72.7,11.4,46.2,144373535,,11/25/25167,Fashion & Retail,Sky Xu,China,Guangzhou,E-commerce,Fashion & Retail,TRUE,Male,Xu,Sky,10500,1/1/1984,42,1984,1,1,125.08,19910000000000,77,9.4,59.2,1397715000,,11/25/25167,Finance & Investments,Changpeng Zhao,United Arab Emirates,Dubai,Cryptocurrency exchange,Finance & Investments,TRUE,Male,Zhao,Changpeng,10500,9/10/1977,48,1977,9,10,114.52,421142267938,77.8,0.1,15.9,9770529,,11/25/25170,Finance & Investments,Andrew Beal,United States,Dallas,"Banks, real estate",Finance & Investments,TRUE,Male,Beal,Andrew,10300,11/29/1952,73,1952,11,29,117.24,21427700000000,78.5,9.6,36.6,328239523,,11/25/25171,Technology,Mike Cannon-Brookes,Australia,Sydney,Software,Technology,TRUE,Male,Cannon-Brookes,Mike,10200,11/17/1979,46,1979,11,17,119.8,1392680589329,82.7,23,47.4,25766605,,11/25/25171,Healthcare,Carl Cook,United States,Bloomington,Medical devices,Healthcare,FALSE,Male,Cook,Carl,10200,8/19/1962,63,1962,8,19,117.24,21427700000000,78.5,9.6,36.6,328239523,,11/25/25171,Technology,David Duffield,United States,Incline Village,Business software,Technology,TRUE,Male,Duffield,David,10200,9/21/1940,85,1940,9,21,117.24,21427700000000,78.5,9.6,36.6,328239523,,11/25/25171,Energy,Jeffery Hildebrand,United States,Houston,Oil,Energy,TRUE,Male,Hildebrand,Jeffery,10200,3/5/1959,67,1959,3,5,117.24,21427700000000,78.5,9.6,36.6,328239523,,11/25/25171,Manufacturing,Viktor Rashnikov,Russia,Magnitogorsk,Steel,Manufacturing,TRUE,Male,Rashnikov,Viktor,10200,10/13/1948,77,1948,10,13,180.75,1699876578871,72.7,11.4,46.2,144373535,,11/25/25171,Technology,Eduardo Saverin,Singapore,Singapore,Facebook,Technology,TRUE,Male,Saverin,Eduardo,10200,3/19/1982,44,1982,3,19,114.41,372062527489,83.1,13.1,21,5703569,,11/25/25171,Automotive,Georg Schaeffler,Germany,Herzogenaurach,Auto parts,Automotive,FALSE,Male,Schaeffler,Georg,10200,10/19/1964,61,1964,10,19,112.85,3845630030824,80.9,11.5,48.8,83132799,,11/25/25171,Fashion & Retail,Christy Walton,United States,Jackson,Walmart,Fashion & Retail,FALSE,Female,Walton,Christy,10200,2/8/1949,77,1949,2,8,117.24,21427700000000,78.5,9.6,36.6,328239523,,11/25/25179,Technology,Scott Farquhar,Australia,Sydney,Software,Technology,TRUE,Male,Farquhar,Scott,10100,12/17/1979,46,1979,12,17,119.8,1392680589329,82.7,23,47.4,25766605,,11/25/25179,Diversified,Quek Leng Chan,Malaysia,Kuala Lumpur,"Banking, property",Diversified,FALSE,Male,Quek,Leng Chan,10100,8/12/1941,84,1941,8,12,121.46,364701517788,76,12,38.7,32447385,,11/25/25179,Real Estate,Wu Yajun,China,Beijing,Real estate,Real Estate,TRUE,Female,Wu,Yajun,10100,1/1/1964,62,1964,1,1,125.08,19910000000000,77,9.4,59.2,1397715000,,11/25/25182,Energy,Autry Stephens,United States,Midland,Oil,Energy,TRUE,Male,Stephens,Autry,10000,3/8/1938,88,1938,3,8,117.24,21427700000000,78.5,9.6,36.6,328239523,,11/25/25183,Service,Liu Yongxing,China,Shanghai,Diversified,Service,TRUE,Male,Liu,Yongxing,9900,6/1/1948,77,1948,6,1,125.08,19910000000000,77,9.4,59.2,1397715000,,11/25/25184,Diversified,Vinod Adani,United Arab Emirates,Dubai,"Infrastructure, commodities",Diversified,TRUE,Male,Adani,Vinod,9800,1/10/1949,77,1949,1,10,114.52,421142267938,77.8,0.1,15.9,9770529,,11/25/25184,Fashion & Retail,Nicolas Puech,Switzerland,Martigny,Hermes,Fashion & Retail,FALSE,Male,Puech,Nicolas,9800,1/29/1943,83,1943,1,29,99.55,703082435360,83.6,10.1,28.8,8574832,,11/25/25184,Logistics,"Jacques Saadé, Jr.",France,Marseille,Shipping,Logistics,FALSE,Male,Saadé,Jacques,9800,8/10/1971,54,1971,8,10,110.05,2715518274227,82.5,24.2,60.7,67059887,,11/25/25184,Logistics,Rodolphe Saadé,France,Marseille,Shipping,Logistics,FALSE,Male,Saadé,Rodolphe,9800,3/3/1970,56,1970,3,3,110.05,2715518274227,82.5,24.2,60.7,67059887,,11/25/25184,Logistics,Tanya Saadé Zeenny,France,Marseille,Shipping,Logistics,FALSE,Female,Saadé Zeenny,Tanya,9800,2/1/1968,58,1968,2,1,110.05,2715518274227,82.5,24.2,60.7,67059887,,11/25/25184,Finance & Investments,Melker Schorling & family,Sweden,Stockholm,Investments,Finance & Investments,TRUE,Male,Schorling,Melker,9800,5/15/1947,79,1947,5,15,110.51,530832908738,82.5,27.9,49.1,10285453,,11/25/25190,Manufacturing,Andrei Guriev & family,Russia,Moscow,Fertilizers,Manufacturing,TRUE,Male,Guriev & family,Andrei,9700,3/24/1960,66,1960,3,24,180.75,1699876578871,72.7,11.4,46.2,144373535,,11/25/25190,Finance & Investments,Michael Kim,South Korea,Seoul,Private equity,Finance & Investments,TRUE,Male,Kim,Michael,9700,10/1/1963,62,1963,10,1,115.16,2029000000000,82.6,15.6,33.2,51709098,,11/25/25190,Technology,Lei Jun,China,Beijing,Smartphones,Technology,TRUE,Male,Lei,Jun,9700,12/16/1969,56,1969,12,16,125.08,19910000000000,77,9.4,59.2,1397715000,,11/25/25190,Manufacturing,Friedhelm Loh,Germany,Haiger,Manufacturing,Manufacturing,FALSE,Male,Loh,Friedhelm,9700,8/15/1946,79,1946,8,15,112.85,3845630030824,80.9,11.5,48.8,83132799,,11/25/25190,Healthcare,Sun Piaoyang,China,Lianyungang,Pharmaceuticals,Healthcare,TRUE,Male,Sun,Piaoyang,9700,9/1/1958,67,1958,9,1,125.08,19910000000000,77,9.4,59.2,1397715000,,11/25/25195,Technology,Rick Cohen & family,United States,Keene,Warehouse automation,Technology,FALSE,Male,Cohen,Rick,9600,7/25/1952,73,1952,7,25,117.24,21427700000000,78.5,9.6,36.6,328239523,,11/25/25195,Energy,Jin Baofang,China,Xingtai,Solar panels,Energy,TRUE,Male,Jin,Baofang,9600,9/1/1952,73,1952,9,1,125.08,19910000000000,77,9.4,59.2,1397715000,,11/25/25195,Manufacturing,Luo Liguo & family,China,Ningbo,Chemicals,Manufacturing,TRUE,Male,Luo,Liguo,9600,3/1/1956,70,1956,3,1,125.08,19910000000000,77,9.4,59.2,1397715000,,11/25/25195,Food & Beverage,Marijke Mars,United States,Los Angeles,"Candy, pet food",Food & Beverage,FALSE,Female,Mars,Marijke,9600,7/28/1964,61,1964,7,28,117.24,21427700000000,78.5,9.6,36.6,328239523,,11/25/25195,Food & Beverage,Pamela Mars,United States,Alexandria,"Candy, pet food",Food & Beverage,FALSE,Female,Mars,Pamela,9600,8/1/1960,65,1960,8,1,117.24,21427700000000,78.5,9.6,36.6,328239523,,11/25/25195,Food & Beverage,Valerie Mars,United States,New York,"Candy, pet food",Food & Beverage,FALSE,Female,Mars,Valerie,9600,1/26/1959,67,1959,1,26,117.24,21427700000000,78.5,9.6,36.6,328239523,,11/25/25195,Food & Beverage,Victoria Mars,United States,Philadelphia,"Candy, pet food",Food & Beverage,FALSE,Female,Mars,Victoria,9600,12/15/1956,69,1956,12,15,117.24,21427700000000,78.5,9.6,36.6,328239523,,11/25/25202,Finance & Investments,Vincent Bolloré & family,France,Paris,Investments,Finance & Investments,FALSE,Male,Bolloré,Vincent,9500,4/1/1952,74,1952,4,1,110.05,2715518274227,82.5,24.2,60.7,67059887,,11/25/25202,Diversified,Jim Pattison,Canada,Vancouver,Diversified,Diversified,TRUE,Male,Pattison,Jim,9500,10/1/1928,97,1928,10,1,116.76,1736425629520,81.9,12.8,24.5,36991981,,11/25/25204,Healthcare,Ernesto Bertarelli,Switzerland,Gstaad,"Biotech, investments",Healthcare,FALSE,Male,Bertarelli,Ernesto,9400,9/22/1965,60,1965,9,22,99.55,703082435360,83.6,10.1,28.8,8574832,,11/25/25204,Technology,Wang Xing,China,Beijing,Food delivery,Technology,TRUE,Male,Wang,Xing,9400,2/18/1979,47,1979,2,18,125.08,19910000000000,77,9.4,59.2,1397715000,,11/25/25206,Technology,Brian Chesky,United States,San Francisco,Airbnb,Technology,TRUE,Male,Chesky,Brian,9300,8/29/1981,44,1981,8,29,117.24,21427700000000,78.5,9.6,36.6,328239523,,11/25/25206,Manufacturing,James Dyson,United Kingdom,Gloucestershire,Vacuums,Manufacturing,TRUE,Male,Dyson,James,9300,5/2/1947,79,1947,5,2,119.62,2827113184696,81.3,25.5,30.6,66834405,,11/25/25208,Diversified,Roman Abramovich & family,Russia,Moscow,"Steel, investments",Diversified,TRUE,Male,Abramovich,Roman,9200,10/24/1966,59,1966,10,24,180.75,1699876578871,72.7,11.4,46.2,144373535,,11/25/25208,Diversified,Antonia Ax:son Johnson & family,Sweden,Stockholm,Diversified,Diversified,FALSE,Female,Ax:son Johnson,Antonia,9200,9/6/1943,82,1943,9,6,110.51,530832908738,82.5,27.9,49.1,10285453,,11/25/25208,Energy,Daniel Kretinsky,Czech Republic,Prague,"Energy, investments",Energy,TRUE,Male,Kretinsky,Daniel,9200,7/9/1975,50,1975,7,9,116.48,246489245495,79,14.9,46.1,10669709,,11/25/25208,Media & Entertainment,John Malone,United States,Elizabeth,Cable television,Media & Entertainment,TRUE,Male,Malone,John,9200,3/7/1941,85,1941,3,7,117.24,21427700000000,78.5,9.6,36.6,328239523,,11/25/25208,Technology,Azim Premji,India,Bangalore,Software services,Technology,FALSE,Male,Premji,Azim,9200,7/24/1945,80,1945,7,24,180.44,2611000000000,69.4,11.2,49.7,1366417754,,11/25/25208,Finance & Investments,Charles Schwab,United States,Woodside,Discount brokerage,Finance & Investments,TRUE,Male,Schwab,Charles,9200,7/29/1937,88,1937,7,29,117.24,21427700000000,78.5,9.6,36.6,328239523,,11/25/25208,Fashion & Retail,Eric Smidt,United States,Beverly Hills,Hardware stores,Fashion & Retail,TRUE,Male,Smidt,Eric,9200,1/1/1960,66,1960,1,1,117.24,21427700000000,78.5,9.6,36.6,328239523,,11/25/25215,Technology,David Cheriton,United States,Palo Alto,Google,Technology,TRUE,Male,Cheriton,David,9000,3/29/1951,75,1951,3,29,117.24,21427700000000,78.5,9.6,36.6,328239523,,11/25/25215,Metals & Mining,Ivan Glasenberg,Switzerland,Ruschlikon,Mining,Metals & Mining,TRUE,Male,Glasenberg,Ivan,9000,1/7/1957,69,1957,1,7,99.55,703082435360,83.6,10.1,28.8,8574832,,11/25/25215,Real Estate,Alexander Otto,Germany,Hamburg,Real estate,Real Estate,FALSE,Male,Otto,Alexander,9000,7/7/1967,58,1967,7,7,112.85,3845630030824,80.9,11.5,48.8,83132799,,11/25/25215,Food & Beverage,Anthony von Mandl,Canada,Vancouver,Alcoholic beverages,Food & Beverage,TRUE,Male,von Mandl,Anthony,9000,3/10/1950,76,1950,3,10,116.76,1736425629520,81.9,12.8,24.5,36991981,,11/25/25215,Manufacturing,Wang Liping & family,China,Changzhou,Hydraulic machinery,Manufacturing,TRUE,Male,Wang,Liping,9000,2/24/1966,60,1966,2,24,125.08,19910000000000,77,9.4,59.2,1397715000,,11/25/25220,Food & Beverage,Finn Rausing,United Kingdom,London,Packaging,Food & Beverage,FALSE,Male,Rausing,Finn,8900,1/1/1955,71,1955,1,1,119.62,2827113184696,81.3,25.5,30.6,66834405,,11/25/25220,Food & Beverage,Jorn Rausing,United Kingdom,Surrey,Packaging,Food & Beverage,FALSE,Male,Rausing,Jorn,8900,1/1/1960,66,1960,1,1,119.62,2827113184696,81.3,25.5,30.6,66834405,,11/25/25220,Food & Beverage,Kirsten Rausing,United Kingdom,Newmarket,Packaging,Food & Beverage,FALSE,Female,Rausing,Kirsten,8900,6/6/1952,73,1952,6,6,119.62,2827113184696,81.3,25.5,30.6,66834405,,11/25/25223,Fashion & Retail,Tatyana Bakalchuk,Russia,Moscow region,Ecommerce,Fashion & Retail,TRUE,Female,Bakalchuk,Tatyana,8800,10/16/1975,50,1975,10,16,180.75,1699876578871,72.7,11.4,46.2,144373535,,11/25/25223,Technology,John Doerr,United States,Woodside,Venture capital,Technology,TRUE,Male,Doerr,John,8800,6/29/1951,74,1951,6,29,117.24,21427700000000,78.5,9.6,36.6,328239523,,11/25/25223,Technology,Richard Liu,China,Beijing,E-commerce,Technology,TRUE,Male,Liu,Richard,8800,3/10/1974,52,1974,3,10,125.08,19910000000000,77,9.4,59.2,1397715000,,11/25/25223,Technology,Dustin Moskovitz,United States,San Francisco,Facebook,Technology,TRUE,Male,Moskovitz,Dustin,8800,5/22/1984,42,1984,5,22,117.24,21427700000000,78.5,9.6,36.6,328239523,,11/25/25223,Technology,Pierre Omidyar,United States,Honolulu,"EBay, PayPal",Technology,TRUE,Male,Omidyar,Pierre,8800,6/21/1967,58,1967,6,21,117.24,21427700000000,78.5,9.6,36.6,328239523,,11/25/25223,Energy,Pei Zhenhua,China,Ningde,Batteries,Energy,TRUE,Male,Pei,Zhenhua,8800,1/1/1959,67,1959,1,1,125.08,19910000000000,77,9.4,59.2,1397715000,,11/25/25223,Energy,Carrie Perrodo & family,United Kingdom,London,Oil,Energy,FALSE,Female,Perrodo,Carrie,8800,1/1/1951,75,1951,1,1,119.62,2827113184696,81.3,25.5,30.6,66834405,,11/25/25230,Manufacturing,Chen Jianhua,China,Wujiang,Chemicals,Manufacturing,TRUE,Male,Chen,Jianhua,8700,1/1/1971,55,1971,1,1,125.08,19910000000000,77,9.4,59.2,1397715000,,11/25/25230,Fashion & Retail,Michael Otto,Germany,Hamburg,"Retail, real estate",Fashion & Retail,FALSE,Male,Otto,Michael,8700,4/12/1943,83,1943,4,12,112.85,3845630030824,80.9,11.5,48.8,83132799,,11/25/25232,Finance & Investments,Leon Black,United States,New York,Private equity,Finance & Investments,TRUE,Male,Black,Leon,8600,7/31/1951,74,1951,7,31,117.24,21427700000000,78.5,9.6,36.6,328239523,,11/25/25232,Finance & Investments,Graeme Hart,New Zealand,Auckland,Investments,Finance & Investments,TRUE,Male,Hart,Graeme,8600,6/6/1955,70,1955,6,6,114.24,206928765544,81.9,29,34.6,4841000,,11/25/25232,Food & Beverage,Ravi Jaipuria,India,Delhi,"Soft drinks, fast food",Food & Beverage,FALSE,Male,Jaipuria,Ravi,8600,11/28/1954,71,1954,11,28,180.44,2611000000000,69.4,11.2,49.7,1366417754,,11/25/25232,Technology,Hasso Plattner & family,Germany,Heidelberg,Software,Technology,TRUE,Male,Plattner,Hasso,8600,1/21/1944,82,1944,1,21,112.85,3845630030824,80.9,11.5,48.8,83132799,,11/25/25232,Food & Beverage,Carlos Alberto Sicupira & family,Switzerland,St. Gallen,Beer,Food & Beverage,TRUE,Male,Sicupira,Carlos Alberto,8600,1/1/1948,78,1948,1,1,99.55,703082435360,83.6,10.1,28.8,8574832,,11/25/25232,Real Estate,Manuel Villar,Philippines,Manila,Real estate,Real Estate,TRUE,Male,Villar,Manuel,8600,12/13/1949,76,1949,12,13,129.61,376795508680,71.1,14,43.1,108116615,,11/25/25232,Technology,Andreas von Bechtolsheim & family,United States,Palo Alto,Google,Technology,TRUE,Male,von Bechtolsheim,Andreas,8600,9/30/1955,70,1955,9,30,117.24,21427700000000,78.5,9.6,36.6,328239523,,11/25/25239,Finance & Investments,"Chase Coleman, III.",United States,New York,Investments,Finance & Investments,TRUE,Male,Coleman,Chase,8500,6/21/1975,50,1975,6,21,117.24,21427700000000,78.5,9.6,36.6,328239523,,11/25/25239,Fashion & Retail,Ann Walton Kroenke,United States,Electra,Walmart,Fashion & Retail,FALSE,Female,Kroenke,Ann Walton,8500,12/18/1948,77,1948,12,18,117.24,21427700000000,78.5,9.6,36.6,328239523,,11/25/25239,Manufacturing,Li Zhenguo & family,China,Xi'an,Solar wafers and modules,Manufacturing,TRUE,Male,Li,Zhenguo,8500,1/1/1968,58,1968,1,1,125.08,19910000000000,77,9.4,59.2,1397715000,,11/25/25242,Media & Entertainment,Jim Kennedy,United States,Atlanta,"Media, automotive",Media & Entertainment,FALSE,Male,Kennedy,Jim,8400,11/29/1947,78,1947,11,29,117.24,21427700000000,78.5,9.6,36.6,328239523,,11/25/25242,Metals & Mining,Nicky Oppenheimer & family,South Africa,Johannesburg,Diamonds,Metals & Mining,FALSE,Male,Oppenheimer,Nicky,8400,6/8/1945,80,1945,6,8,158.93,351431649241,63.9,27.5,29.2,58558270,,11/25/25242,Media & Entertainment,Blair Parry-Okeden,Australia,New South Wales,"Media, automotive",Media & Entertainment,FALSE,Female,Parry-Okeden,Blair,8400,5/21/1950,76,1950,5,21,119.8,1392680589329,82.7,23,47.4,25766605,,11/25/25242,Metals & Mining,Zheng Shuliang & family,China,Binzhou,Aluminum products,Metals & Mining,FALSE,Female,Zheng,Shuliang,8400,1/1/1946,80,1946,1,1,125.08,19910000000000,77,9.4,59.2,1397715000,,11/25/25246,Fashion & Retail,John Morris,United States,Springfield,Sporting goods retail,Fashion & Retail,TRUE,Male,Morris,John,8300,3/19/1948,78,1948,3,19,117.24,21427700000000,78.5,9.6,36.6,328239523,,11/25/25249,Energy,German Khan,Russia,Moscow,"Oil, banking, telecom",Energy,TRUE,Male,Khan,German,8200,10/24/1961,64,1961,10,24,180.75,1699876578871,72.7,11.4,46.2,144373535,,11/25/25249,Diversified,Abdulsamad Rabiu,Nigeria,Lagos,"Cement, sugar",Diversified,FALSE,Male,Rabiu,Abdulsamad,8200,8/4/1960,65,1960,8,4,267.51,448120428859,54.3,1.5,34.8,200963599,,11/25/25249,Finance & Investments,George Roberts,United States,Atherton,Private equity,Finance & Investments,TRUE,Male,Roberts,George,8200,9/14/1943,82,1943,9,14,117.24,21427700000000,78.5,9.6,36.6,328239523,,11/25/25249,Real Estate,Kushal Pal Singh,India,Delhi,Real estate,Real Estate,FALSE,Male,Singh,Kushal Pal,8200,8/15/1931,94,1931,8,15,180.44,2611000000000,69.4,11.2,49.7,1366417754,,11/25/25249,Real Estate,Wang Jianlin,China,Beijing,Real estate,Real Estate,TRUE,Male,Wang,Jianlin,8200,10/1/1954,71,1954,10,1,125.08,19910000000000,77,9.4,59.2,1397715000,,11/25/25249,Real Estate,Yang Huiyan & family,China,Foshan,Real estate,Real Estate,FALSE,Female,Yang,Huiyan,8200,9/27/1981,44,1981,9,27,125.08,19910000000000,77,9.4,59.2,1397715000,,11/25/25256,Diversified,Laurent Dassault,France,Paris,Diversified,Diversified,FALSE,Male,Dassault,Laurent,8100,7/7/1953,72,1953,7,7,110.05,2715518274227,82.5,24.2,60.7,67059887,,11/25/25256,Diversified,Thierry Dassault,France,Paris,Diversified,Diversified,FALSE,Male,Dassault,Thierry,8100,3/26/1957,69,1957,3,26,110.05,2715518274227,82.5,24.2,60.7,67059887,,11/25/25256,Food & Beverage,Tilman Fertitta,United States,Houston,"Houston Rockets, entertainment",Food & Beverage,TRUE,Male,Fertitta,Tilman,8100,6/25/1957,68,1957,6,25,117.24,21427700000000,78.5,9.6,36.6,328239523,,11/25/25256,Diversified,Marie-Hélène Habert-Dassault,France,Paris,Diversified,Diversified,FALSE,Female,Habert-Dassault,Marie-Hélène,8100,4/4/1965,61,1965,4,4,110.05,2715518274227,82.5,24.2,60.7,67059887,,11/25/25256,Gambling & Casinos,Karel Komarek,Switzerland,Verbier,"Oil and gas, IT, lotteries",Gambling & Casinos,TRUE,Male,Komarek,Karel,8100,3/15/1969,57,1969,3,15,99.55,703082435360,83.6,10.1,28.8,8574832,,11/25/25261,Technology,Nathan Blecharczyk,United States,San Francisco,Airbnb,Technology,TRUE,Male,Blecharczyk,Nathan,8000,6/11/1983,42,1983,6,11,117.24,21427700000000,78.5,9.6,36.6,328239523,,11/25/25261,Energy,Leonid Fedun,Russia,Moscow,Oil,Energy,TRUE,Male,Fedun,Leonid,8000,4/5/1956,70,1956,4,5,180.75,1699876578871,72.7,11.4,46.2,144373535,,11/25/25261,Fashion & Retail,Bernard Marcus,United States,Atlanta,Home Depot,Fashion & Retail,TRUE,Male,Marcus,Bernard,8000,5/12/1929,97,1929,5,12,117.24,21427700000000,78.5,9.6,36.6,328239523,,11/25/25261,Finance & Investments,Patrick Ryan,United States,Winnetka,Insurance,Finance & Investments,TRUE,Male,Ryan,Patrick,8000,5/15/1937,89,1937,5,15,117.24,21427700000000,78.5,9.6,36.6,328239523,,11/25/25261,Finance & Investments,Robert F. Smith,United States,Austin,Private equity,Finance & Investments,TRUE,Male,Smith,Robert F.,8000,12/1/1962,63,1962,12,1,117.24,21427700000000,78.5,9.6,36.6,328239523,,11/25/25261,Metals & Mining,Pavel Tykac,Czech Republic,Prague,Coal mines,Metals & Mining,TRUE,Male,Tykac,Pavel,8000,5/15/1964,62,1964,5,15,116.48,246489245495,79,14.9,46.1,10669709,,11/25/25268,Finance & Investments,Orlando Bravo,United States,Miami Beach,Private equity,Finance & Investments,TRUE,Male,Bravo,Orlando,7900,9/23/1970,55,1970,9,23,117.24,21427700000000,78.5,9.6,36.6,328239523,,11/25/25268,Fashion & Retail,Ding Shizhong,China,Quanzhou,Sports apparel,Fashion & Retail,TRUE,Male,Ding,Shizhong,7900,12/1/1970,55,1970,12,1,125.08,19910000000000,77,9.4,59.2,1397715000,,11/25/25268,Fashion & Retail,Nancy Walton Laurie,United States,Henderson,Walmart,Fashion & Retail,FALSE,Female,Laurie,Nancy Walton,7900,5/15/1951,75,1951,5,15,117.24,21427700000000,78.5,9.6,36.6,328239523,,11/25/25268,Technology,Jay Y. Lee,South Korea,Seoul,Samsung,Technology,FALSE,Male,Lee,Jay Y.,7900,6/23/1968,57,1968,6,23,115.16,2029000000000,82.6,15.6,33.2,51709098,,11/25/25268,Finance & Investments,Ramzi Musallam,United States,New York,Private equity,Finance & Investments,TRUE,Male,Musallam,Ramzi,7900,9/17/1968,57,1968,9,17,117.24,21427700000000,78.5,9.6,36.6,328239523,,11/25/25268,Finance & Investments,David Shaw,United States,New York,Hedge funds,Finance & Investments,TRUE,Male,Shaw,David,7900,3/29/1951,75,1951,3,29,117.24,21427700000000,78.5,9.6,36.6,328239523,,11/25/25268,Metals & Mining,Andrei Skoch & family,Russia,Moscow,Metals and mining,Metals & Mining,TRUE,Male,Skoch & family,Andrei,7900,1/30/1966,60,1966,1,30,180.75,1699876578871,72.7,11.4,46.2,144373535,,11/25/25268,Diversified,Georg Stumpf,Austria,Vienna,"Real estate, construction",Diversified,TRUE,Male,Stumpf,Georg,7900,9/14/1972,53,1972,9,14,118.06,446314739528,81.6,25.4,51.4,8877067,,11/25/25276,Telecom,Rocco Commisso,United States,Saddle River,Telecom,Telecom,TRUE,Male,Commisso,Rocco,7800,11/25/1949,76,1949,11,25,117.24,21427700000000,78.5,9.6,36.6,328239523,,11/25/25276,Manufacturing,Li Shuirong & family,China,Hangzhou,Petrochemicals,Manufacturing,TRUE,Male,Li,Shuirong,7800,7/1/1956,69,1956,7,1,125.08,19910000000000,77,9.4,59.2,1397715000,,11/25/25276,Technology,Qi Shi & family,China,Shanghai,Financial information,Technology,TRUE,Male,Qi,Shi,7800,1/3/1970,56,1970,1,3,125.08,19910000000000,77,9.4,59.2,1397715000,,11/25/25276,Manufacturing,Yao Liangsong,China,Guangzhou,Furniture,Manufacturing,TRUE,Male,Yao,Liangsong,7800,8/1/1964,61,1964,8,1,125.08,19910000000000,77,9.4,59.2,1397715000,,11/25/25282,Food & Beverage,Jean-Michel Besnier,France,Laval,Cheese,Food & Beverage,FALSE,Male,Besnier,Jean-Michel,7700,6/5/1967,58,1967,6,5,110.05,2715518274227,82.5,24.2,60.7,67059887,,11/25/25282,Food & Beverage,Marie Besnier Beauvalot,France,Laval,Cheese,Food & Beverage,FALSE,Female,Besnier Beauvalot,Marie,7700,7/30/1980,45,1980,7,30,110.05,2715518274227,82.5,24.2,60.7,67059887,,11/25/25282,Media & Entertainment,David Geffen,United States,Beverly Hills,"Movies, record labels",Media & Entertainment,TRUE,Male,Geffen,David,7700,2/21/1943,83,1943,2,21,117.24,21427700000000,78.5,9.6,36.6,328239523,,11/25/25282,Technology,Robin Li,China,Beijing,Internet search,Technology,TRUE,Male,Li,Robin,7700,11/17/1968,57,1968,11,17,125.08,19910000000000,77,9.4,59.2,1397715000,,11/25/25282,Service,Liu Yonghao & family,China,Chengdu,Agribusiness,Service,TRUE,Male,Liu,Yonghao,7700,9/1/1951,74,1951,9,1,125.08,19910000000000,77,9.4,59.2,1397715000,,11/25/25282,Technology,Henry Samueli,United States,Newport Beach,Semiconductors,Technology,TRUE,Male,Samueli,Henry,7700,9/20/1954,71,1954,9,20,117.24,21427700000000,78.5,9.6,36.6,328239523,,11/25/25282,Healthcare,Reinhold Schmieding,United States,Naples,Medical devices,Healthcare,TRUE,Male,Schmieding,Reinhold,7700,1/3/1955,71,1955,1,3,117.24,21427700000000,78.5,9.6,36.6,328239523,,11/25/25282,Real Estate,Ivar Tollefsen,Norway,Oslo,Real estate,Real Estate,TRUE,Male,Tollefsen,Ivar,7700,6/23/1961,64,1961,6,23,120.27,403336363636,82.8,23.9,36.2,5347896,,11/25/25290,Energy,Cao Renxian,China,Hefei,Photovoltaic equipment,Energy,TRUE,Male,Cao,Renxian,7600,7/24/1968,57,1968,7,24,125.08,19910000000000,77,9.4,59.2,1397715000,,11/25/25290,Healthcare,Hasmukh Chudgar & family,India,Ahmedabad,Pharmaceuticals,Healthcare,TRUE,Male,Chudgar,Hasmukh,7600,9/19/1933,92,1933,9,19,180.44,2611000000000,69.4,11.2,49.7,1366417754,,11/25/25290,Manufacturing,Andrew Currie,United Kingdom,London,Chemicals,Manufacturing,TRUE,Male,Currie,Andrew,7600,12/4/1955,70,1955,12,4,119.62,2827113184696,81.3,25.5,30.6,66834405,,11/25/25290,Technology,Joe Gebbia,United States,Austin,Airbnb,Technology,TRUE,Male,Gebbia,Joe,7600,8/21/1981,44,1981,8,21,117.24,21427700000000,78.5,9.6,36.6,328239523,,11/25/25290,Real Estate,Philip Ng,Singapore,Singapore,Real Estate,Real Estate,FALSE,Male,Ng,Philip,7600,1/1/1959,67,1959,1,1,114.41,372062527489,83.1,13.1,21,5703569,,11/25/25290,Manufacturing,John Reece,United Kingdom,London,Chemicals,Manufacturing,TRUE,Male,Reece,John,7600,3/7/1957,69,1957,3,7,119.62,2827113184696,81.3,25.5,30.6,66834405,,11/25/25290,Real Estate,Leonard Stern,United States,New York,Real estate,Real Estate,FALSE,Male,Stern,Leonard,7600,3/28/1938,88,1938,3,28,117.24,21427700000000,78.5,9.6,36.6,328239523,,11/25/25290,Healthcare,Zhong Huijuan,China,Shanghai,Pharmaceuticals,Healthcare,TRUE,Female,Zhong,Huijuan,7600,1/1/1961,65,1961,1,1,125.08,19910000000000,77,9.4,59.2,1397715000,,11/25/25299,Sports,Arthur Blank,United States,Atlanta,Home Depot,Sports,TRUE,Male,Blank,Arthur,7500,9/27/1942,83,1942,9,27,117.24,21427700000000,78.5,9.6,36.6,328239523,,11/25/25299,Fashion & Retail,Charles Butt,United States,San Antonio,Supermarkets,Fashion & Retail,FALSE,Male,Butt,Charles,7500,2/3/1938,88,1938,2,3,117.24,21427700000000,78.5,9.6,36.6,328239523,,11/25/25299,Fashion & Retail,Ding Shijia,China,Quanzhou,Sports apparel,Fashion & Retail,TRUE,Male,Ding,Shijia,7500,1/1/1964,62,1964,1,1,125.08,19910000000000,77,9.4,59.2,1397715000,,11/25/25299,Finance & Investments,"Paul Tudor Jones, II.",United States,Palm Beach,Hedge funds,Finance & Investments,TRUE,Male,Jones,Paul Tudor,7500,9/28/1954,71,1954,9,28,117.24,21427700000000,78.5,9.6,36.6,328239523,,11/25/25299,Finance & Investments,Henry Kravis,United States,New York,Private equity,Finance & Investments,TRUE,Male,Kravis,Henry,7500,1/6/1944,82,1944,1,6,117.24,21427700000000,78.5,9.6,36.6,328239523,,11/25/25299,Food & Beverage,Zhang Yong,Singapore,Singapore,Restaurants,Food & Beverage,TRUE,Male,Zhang,Yong,7500,7/1/1970,55,1970,7,1,114.41,372062527489,83.1,13.1,21,5703569,,11/25/25305,Technology,James Goodnight,United States,Cary,Software,Technology,TRUE,Male,Goodnight,James,7400,1/6/1943,83,1943,1,6,117.24,21427700000000,78.5,9.6,36.6,328239523,,11/25/25305,Manufacturing,Sri Prakash Lohia,United Kingdom,London,Petrochemicals,Manufacturing,FALSE,Male,Lohia,Sri Prakash,7400,8/11/1952,73,1952,8,11,119.62,2827113184696,81.3,25.5,30.6,66834405,,11/25/25305,Fashion & Retail,Ma Jianrong,China,Ningbo,"Textiles, apparel",Fashion & Retail,TRUE,Male,Ma,Jianrong,7400,1/1/1964,62,1964,1,1,125.08,19910000000000,77,9.4,59.2,1397715000,,11/25/25305,Real Estate,Robert Ng,Singapore,Singapore,Real estate,Real Estate,FALSE,Male,Ng,Robert,7400,1/1/1952,74,1952,1,1,114.41,372062527489,83.1,13.1,21,5703569,,11/25/25305,Manufacturing,Steven Rales,United States,Santa Barbara,"Manufacturing, investments",Manufacturing,TRUE,Male,Rales,Steven,7400,3/31/1951,75,1951,3,31,117.24,21427700000000,78.5,9.6,36.6,328239523,,11/25/25305,Construction & Engineering,Nassef Sawiris,Egypt,Cairo,"Construction, investments",Construction & Engineering,FALSE,Male,Sawiris,Nassef,7400,1/19/1961,65,1961,1,19,288.57,303175127598,71.8,12.5,44.4,100388073,,11/25/25305,Food & Beverage,Harry Stine,United States,Adel,Agriculture,Food & Beverage,TRUE,Male,Stine,Harry,7400,11/30/1941,84,1941,11,30,117.24,21427700000000,78.5,9.6,36.6,328239523,,11/25/25312,Manufacturing,Benu Gopal Bangur,India,Kolkata,Cement,Manufacturing,FALSE,Male,Bangur,Benu Gopal,7300,6/1/1931,94,1931,6,1,180.44,2611000000000,69.4,11.2,49.7,1366417754,,11/25/25312,Metals & Mining,Iskander Makhmudov,Russia,Moscow,"Mining, metals, machinery",Metals & Mining,TRUE,Male,Makhmudov,Iskander,7300,12/5/1963,62,1963,12,5,180.75,1699876578871,72.7,11.4,46.2,144373535,,11/25/25312,Fashion & Retail,Anders Holch Povlsen,Denmark,Aarhus,Fashion retail,Fashion & Retail,FALSE,Male,Povlsen,Anders Holch,7300,11/4/1972,53,1972,11,4,110.35,348078018464,81,32.4,23.8,5818553,,11/25/25312,Logistics,Enrique Razon Jr.,Philippines,Manila,Ports,Logistics,FALSE,Male,Razon Jr.,Enrique,7300,3/3/1960,66,1960,3,3,129.61,376795508680,71.1,14,43.1,108116615,,11/25/25312,Technology,Wang Laichun,China,Shenzhen,Electronics components,Technology,TRUE,Female,Wang,Laichun,7300,6/3/1967,58,1967,6,3,125.08,19910000000000,77,9.4,59.2,1397715000,,11/25/25317,Finance & Investments,Arthur Dantchik,United States,Gladwyne,"Trading, investments",Finance & Investments,TRUE,Male,Dantchik,Arthur,7200,11/25/1957,68,1957,11,25,117.24,21427700000000,78.5,9.6,36.6,328239523,,11/25/25317,Real Estate,Jeff Greene,United States,Palm Beach,"Real estate, investments",Real Estate,TRUE,Male,Greene,Jeff,7200,12/10/1954,71,1954,12,10,117.24,21427700000000,78.5,9.6,36.6,328239523,,11/25/25317,Finance & Investments,Don Hankey,United States,Malibu,Auto loans,Finance & Investments,TRUE,Male,Hankey,Don,7200,6/13/1943,82,1943,6,13,117.24,21427700000000,78.5,9.6,36.6,328239523,,11/25/25317,Energy,Richard Kinder,United States,Houston,Pipelines,Energy,TRUE,Male,Kinder,Richard,7200,10/19/1944,81,1944,10,19,117.24,21427700000000,78.5,9.6,36.6,328239523,,11/25/25317,Finance & Investments,Guillaume Pousaz,United Arab Emirates,Dubai,Fintech,Finance & Investments,TRUE,Male,Pousaz,Guillaume,7200,8/15/1981,44,1981,8,15,114.52,421142267938,77.8,0.1,15.9,9770529,,11/25/25317,Fashion & Retail,Takahisa Takahara,Japan,Tokyo,Personal care goods,Fashion & Retail,FALSE,Male,Takahara,Takahisa,7200,7/12/1961,64,1961,7,12,105.48,5081769542380,84.2,11.9,46.7,126226568,,11/25/25317,Food & Beverage,Zong Qinghou,China,Hangzhou,Beverages,Food & Beverage,TRUE,Male,Zong,Qinghou,7200,10/1/1945,80,1945,10,1,125.08,19910000000000,77,9.4,59.2,1397715000,,11/25/25325,Technology,Judy Faulkner,United States,Madison,Healthcare software,Technology,TRUE,Female,Faulkner,Judy,7100,8/1/1943,82,1943,8,1,117.24,21427700000000,78.5,9.6,36.6,328239523,,11/25/25325,Gambling & Casinos,Johann Graf,Austria,Vienna,Gambling,Gambling & Casinos,TRUE,Male,Graf,Johann,7100,1/3/1947,79,1947,1,3,118.06,446314739528,81.6,25.4,51.4,8877067,,11/25/25325,Service,Tamara Gustavson,United States,Lexington,Self storage,Service,FALSE,Female,Gustavson,Tamara,7100,11/16/1961,64,1961,11,16,117.24,21427700000000,78.5,9.6,36.6,328239523,,11/25/25325,Manufacturing,Liang Wengen,China,Changsha,Construction equipment,Manufacturing,TRUE,Male,Liang,Wengen,7100,12/14/1956,69,1956,12,14,125.08,19910000000000,77,9.4,59.2,1397715000,,11/25/25325,Healthcare,Frederik Paulsen,Switzerland,Lausanne,Health care,Healthcare,FALSE,Male,Paulsen,Frederik,7100,10/30/1950,75,1950,10,30,99.55,703082435360,83.6,10.1,28.8,8574832,,11/25/25325,Finance & Investments,Wee Cho Yaw,Singapore,Singapore,Banking,Finance & Investments,FALSE,Male,Wee,Cho Yaw,7100,1/10/1929,97,1929,1,10,114.41,372062527489,83.1,13.1,21,5703569,,11/25/25325,Manufacturing,Zhang Hejun,China,Ningbo,Electronics,Manufacturing,TRUE,Male,Zhang,Hejun,7100,1/1/1952,74,1952,1,1,125.08,19910000000000,77,9.4,59.2,1397715000,,11/25/25332,Technology,Marc Benioff,United States,San Francisco,Business software,Technology,TRUE,Male,Benioff,Marc,7000,9/25/1964,61,1964,9,25,117.24,21427700000000,78.5,9.6,36.6,328239523,,11/25/25332,Media & Entertainment,Dmitri Bukhman,United Kingdom,London,Online games,Media & Entertainment,TRUE,Male,Bukhman,Dmitri,7000,5/27/1985,40,1985,5,27,119.62,2827113184696,81.3,25.5,30.6,66834405,,11/25/25332,Media & Entertainment,Igor Bukhman,United Kingdom,London,Online games,Media & Entertainment,TRUE,Male,Bukhman,Igor,7000,3/29/1982,44,1982,3,29,119.62,2827113184696,81.3,25.5,30.6,66834405,,11/25/25332,Technology,Jack Dangermond,United States,Redlands,Mapping software,Technology,TRUE,Male,Dangermond,Jack,7000,7/23/1945,80,1945,7,23,117.24,21427700000000,78.5,9.6,36.6,328239523,,11/25/25332,Manufacturing,Ashwin Dani & family,India,Mumbai,Paints,Manufacturing,FALSE,Male,Dani,Ashwin,7000,10/24/1942,83,1942,10,24,180.44,2611000000000,69.4,11.2,49.7,1366417754,,11/25/25332,Fashion & Retail,Ralph Lauren,United States,New York,Apparel,Fashion & Retail,TRUE,Male,Lauren,Ralph,7000,10/14/1939,86,1939,10,14,117.24,21427700000000,78.5,9.6,36.6,328239523,,11/25/25332,Diversified,Rohiqa Cyrus Mistry,India,Mumbai,Diversified,Diversified,FALSE,Female,Mistry,Rohiqa Cyrus,7000,6/6/1967,58,1967,6,6,180.44,2611000000000,69.4,11.2,49.7,1366417754,,11/25/25332,Diversified,Shapoor Mistry,India,Mumbai,Diversified,Diversified,FALSE,Male,Mistry,Shapoor,7000,9/6/1964,61,1964,9,6,180.44,2611000000000,69.4,11.2,49.7,1366417754,,11/25/25332,Food & Beverage,J. Christopher Reyes,United States,Hobe Sound,Food distribution,Food & Beverage,TRUE,Male,Reyes,J. Christopher,7000,12/29/1953,72,1953,12,29,117.24,21427700000000,78.5,9.6,36.6,328239523,,11/25/25332,Food & Beverage,Jude Reyes,United States,Palm Beach,Food distribution,Food & Beverage,TRUE,Male,Reyes,Jude,7000,9/16/1955,70,1955,9,16,117.24,21427700000000,78.5,9.6,36.6,328239523,,11/25/25332,Food & Beverage,Don Vultaggio & family,United States,Port Washington,Beverages,Food & Beverage,TRUE,Male,Vultaggio,Don,7000,2/26/1952,74,1952,2,26,117.24,21427700000000,78.5,9.6,36.6,328239523,,11/25/25344,Diversified,Edythe Broad & family,United States,Los Angeles,"Homebuilding, insurance",Diversified,FALSE,Female,Broad,Edythe,6900,1/1/1936,90,1936,1,1,117.24,21427700000000,78.5,9.6,36.6,328239523,,11/25/25344,Food & Beverage,Pauline MacMillan Keinath,United States,St. Louis,Cargill,Food & Beverage,FALSE,Female,Keinath,Pauline MacMillan,6900,1/1/1934,92,1934,1,1,117.24,21427700000000,78.5,9.6,36.6,328239523,,11/25/25344,Finance & Investments,Philippe Laffont,United States,New York,Hedge fund,Finance & Investments,TRUE,Male,Laffont,Philippe,6900,9/16/1967,58,1967,9,16,117.24,21427700000000,78.5,9.6,36.6,328239523,,11/25/25344,Technology,Liu Jincheng & family,China,Huizhou,Lithium batteries,Technology,TRUE,Male,Liu,Jincheng,6900,9/22/1964,61,1964,9,22,125.08,19910000000000,77,9.4,59.2,1397715000,,11/25/25344,Real Estate,Igor Olenicoff,United States,Lighthouse Point,Real estate,Real Estate,TRUE,Male,Olenicoff,Igor,6900,9/20/1942,83,1942,9,20,117.24,21427700000000,78.5,9.6,36.6,328239523,,11/25/25344,Fashion & Retail,Sandra Ortega Mera,Spain,La Coruna,Zara,Fashion & Retail,FALSE,Female,Ortega Mera,Sandra,6900,7/9/1968,57,1968,7,9,110.96,1394116310769,83.3,14.2,47,47076781,,11/25/25344,Healthcare,Ronda Stryker,United States,Portage,Medical equipment,Healthcare,FALSE,Female,Stryker,Ronda,6900,5/1/1954,72,1954,5,1,117.24,21427700000000,78.5,9.6,36.6,328239523,,11/25/25352,Energy,Dannine Avara,United States,Houston,Pipelines,Energy,FALSE,Female,Avara,Dannine,6800,3/9/1964,62,1964,3,9,117.24,21427700000000,78.5,9.6,36.6,328239523,,11/25/25352,Diversified,Silvio Berlusconi & family,Italy,Milan,Media,Diversified,TRUE,Male,Berlusconi,Silvio,6800,9/29/1936,89,1936,9,29,110.62,2001244392042,82.9,24.3,59.1,60297396,,11/25/25352,Gambling & Casinos,Denise Coates,United Kingdom,Stoke-on-Trent,Online gambling,Gambling & Casinos,TRUE,Female,Coates,Denise,6800,9/26/1967,58,1967,9,26,119.62,2827113184696,81.3,25.5,30.6,66834405,,11/25/25352,Energy,Scott Duncan,United States,Houston,Pipelines,Energy,FALSE,Male,Duncan,Scott,6800,11/1/1982,43,1982,11,1,117.24,21427700000000,78.5,9.6,36.6,328239523,,11/25/25352,Energy,Milane Frantz,United States,Houston,Pipelines,Energy,FALSE,Female,Frantz,Milane,6800,8/12/1969,56,1969,8,12,117.24,21427700000000,78.5,9.6,36.6,328239523,,11/25/25352,Finance & Investments,"Edward Johnson, IV.",United States,Boston,Fidelity,Finance & Investments,FALSE,Male,Johnson,Edward,6800,11/18/1964,61,1964,11,18,117.24,21427700000000,78.5,9.6,36.6,328239523,,11/25/25352,Finance & Investments,Yuri Milner,United States,Los Altos,Tech investments,Finance & Investments,TRUE,Male,Milner,Yuri,6800,11/11/1961,64,1961,11,11,117.24,21427700000000,78.5,9.6,36.6,328239523,,11/25/25352,Technology,Gordon Moore,United States,Woodside,Intel,Technology,TRUE,Male,Moore,Gordon,6800,1/3/1929,97,1929,1,3,117.24,21427700000000,78.5,9.6,36.6,328239523,,11/25/25352,Finance & Investments,John Overdeck,United States,Millburn,Hedge funds,Finance & Investments,TRUE,Male,Overdeck,John,6800,12/21/1969,56,1969,12,21,117.24,21427700000000,78.5,9.6,36.6,328239523,,11/25/25352,Finance & Investments,David Siegel,United States,Scarsdale,Hedge funds,Finance & Investments,TRUE,Male,Siegel,David,6800,7/15/1961,64,1961,7,15,117.24,21427700000000,78.5,9.6,36.6,328239523,,11/25/25352,Diversified,Viktor Vekselberg,Russia,Moscow,"Metals, investments",Diversified,TRUE,Male,Vekselberg,Viktor,6800,4/14/1957,69,1957,4,14,180.75,1699876578871,72.7,11.4,46.2,144373535,,11/25/25352,Technology,Wang Laisheng,China,Shenzhen,Electronics components,Technology,TRUE,Male,Wang,Laisheng,6800,12/14/1964,61,1964,12,14,125.08,19910000000000,77,9.4,59.2,1397715000,,11/25/25352,Energy,Randa Duncan Williams,United States,Houston,Pipelines,Energy,FALSE,Female,Williams,Randa Duncan,6800,8/28/1961,64,1961,8,28,117.24,21427700000000,78.5,9.6,36.6,328239523,,11/25/25365,Finance & Investments,Ken Fisher,United States,Dallas,Money management,Finance & Investments,TRUE,Male,Fisher,Ken,6700,11/29/1950,75,1950,11,29,117.24,21427700000000,78.5,9.6,36.6,328239523,,11/25/25365,Finance & Investments,Christopher Hohn,United Kingdom,London,Hedge funds,Finance & Investments,TRUE,Male,Hohn,Christopher,6700,10/27/1966,59,1966,10,27,119.62,2827113184696,81.3,25.5,30.6,66834405,,11/25/25365,Manufacturing,Kjeld Kirk Kristiansen,Denmark,Billund,Lego,Manufacturing,FALSE,Male,Kristiansen,Kjeld Kirk,6700,12/27/1947,78,1947,12,27,110.35,348078018464,81,32.4,23.8,5818553,,11/25/25365,Manufacturing,Sofie Kirk Kristiansen,Denmark,Billund,Lego,Manufacturing,FALSE,Female,Kristiansen,Sofie Kirk,6700,1/1/1976,50,1976,1,1,110.35,348078018464,81,32.4,23.8,5818553,,11/25/25365,Manufacturing,Thomas Kirk Kristiansen,Denmark,Billund,Lego,Manufacturing,FALSE,Male,Kristiansen,Thomas Kirk,6700,1/1/1979,47,1979,1,1,110.35,348078018464,81,32.4,23.8,5818553,,11/25/25365,Healthcare,Massimiliana Landini Aleotti & family,Italy,Fiesole,Pharmaceuticals,Healthcare,FALSE,Female,Landini Aleotti,Massimiliana,6700,1/1/1943,83,1943,1,1,110.62,2001244392042,82.9,24.3,59.1,60297396,,11/25/25365,Automotive,Li Ping,China,Ningde,Batteries,Automotive,TRUE,Male,Li,Ping,6700,1/1/1968,58,1968,1,1,125.08,19910000000000,77,9.4,59.2,1397715000,,11/25/25365,Manufacturing,Lin Jianhua,China,Hangzhou,Solar panel components,Manufacturing,TRUE,Male,Lin,Jianhua,6700,8/1/1962,63,1962,8,1,125.08,19910000000000,77,9.4,59.2,1397715000,,11/25/25365,Manufacturing,Magdalena Martullo-Blocher,Switzerland,Feldmeilen,Chemicals,Manufacturing,FALSE,Female,Martullo-Blocher,Magdalena,6700,1/1/1969,57,1969,1,1,99.55,703082435360,83.6,10.1,28.8,8574832,,11/25/25365,Telecom,Xavier Niel,France,Paris,"Internet, telecom",Telecom,TRUE,Male,Niel,Xavier,6700,8/25/1967,58,1967,8,25,110.05,2715518274227,82.5,24.2,60.7,67059887,,11/25/25365,Energy,Terrence Pegula,United States,Boca Raton,Natural gas,Energy,TRUE,Male,Pegula,Terrence,6700,3/27/1951,75,1951,3,27,117.24,21427700000000,78.5,9.6,36.6,328239523,,11/25/25365,Real Estate,"Edward Roski, Jr.",United States,Los Angeles,Real estate,Real Estate,FALSE,Male,Roski,Edward,6700,12/25/1938,87,1938,12,25,117.24,21427700000000,78.5,9.6,36.6,328239523,,11/25/25365,Real Estate,John A. Sobrato & family,United States,Atherton,Real estate,Real Estate,TRUE,Male,Sobrato,John A.,6700,5/23/1939,87,1939,5,23,117.24,21427700000000,78.5,9.6,36.6,328239523,,11/25/25365,Finance & Investments,George Soros,United States,Katonah,Hedge funds,Finance & Investments,TRUE,Male,Soros,George,6700,8/12/1930,95,1930,8,12,117.24,21427700000000,78.5,9.6,36.6,328239523,,11/25/25365,Technology,David Sun,United States,Irvine,Computer hardware,Technology,TRUE,Male,Sun,David,6700,10/12/1951,74,1951,10,12,117.24,21427700000000,78.5,9.6,36.6,328239523,,11/25/25365,Manufacturing,Agnete Kirk Thinggaard,Denmark,Billund,Lego,Manufacturing,FALSE,Female,Thinggaard,Agnete Kirk,6700,5/18/1983,43,1983,5,18,110.35,348078018464,81,32.4,23.8,5818553,,11/25/25365,Technology,John Tu,United States,Rolling Hills,Computer hardware,Technology,TRUE,Male,Tu,John,6700,8/12/1941,84,1941,8,12,117.24,21427700000000,78.5,9.6,36.6,328239523,,11/25/25365,Food & Beverage,Xu Shihui,China,Quanzhou,"Snacks, beverages",Food & Beverage,TRUE,Male,Xu,Shihui,6700,1/1/1958,68,1958,1,1,125.08,19910000000000,77,9.4,59.2,1397715000,,11/25/25383,Manufacturing,Rahel Blocher,Switzerland,Wilen bei Wollerau,Chemicals,Manufacturing,FALSE,Female,Blocher,Rahel,6600,1/1/1976,50,1976,1,1,99.55,703082435360,83.6,10.1,28.8,8574832,,11/25/25383,Food & Beverage,Bubba Cathy,United States,Atlanta,Chick-fil-A,Food & Beverage,FALSE,Male,Cathy,Bubba,6600,4/22/1954,72,1954,4,22,117.24,21427700000000,78.5,9.6,36.6,328239523,,11/25/25383,Food & Beverage,Dan Cathy,United States,Atlanta,Chick-fil-A,Food & Beverage,FALSE,Male,Cathy,Dan,6600,3/1/1953,73,1953,3,1,117.24,21427700000000,78.5,9.6,36.6,328239523,,11/25/25383,Food & Beverage,Trudy Cathy White,United States,Hampton,Chick-fil-A,Food & Beverage,FALSE,Female,Cathy White,Trudy,6600,12/17/1955,70,1955,12,17,117.24,21427700000000,78.5,9.6,36.6,328239523,,11/25/25383,Finance & Investments,Bruce Kovner,United States,New York,Hedge funds,Finance & Investments,TRUE,Male,Kovner,Bruce,6600,2/25/1945,81,1945,2,25,117.24,21427700000000,78.5,9.6,36.6,328239523,,11/25/25383,Technology,"Henry Nicholas, III.",United States,Newport Coast,Semiconductors,Technology,TRUE,Male,Nicholas,Henry,6600,10/8/1959,66,1959,10,8,117.24,21427700000000,78.5,9.6,36.6,328239523,,11/25/25383,Finance & Investments,Nadia Thiele,Germany,Munich,Investments,Finance & Investments,FALSE,Female,Thiele,Nadia,6600,1/7/1976,50,1976,1,7,112.85,3845630030824,80.9,11.5,48.8,83132799,,11/25/25390,Finance & Investments,David Bonderman,United States,Fort Worth,Private equity,Finance & Investments,TRUE,Male,Bonderman,David,6500,11/27/1942,83,1942,11,27,117.24,21427700000000,78.5,9.6,36.6,328239523,,11/25/25390,Technology,Melinda French Gates,United States,Medina,Microsoft,Technology,FALSE,Female,French Gates,Melinda,6500,8/15/1964,61,1964,8,15,117.24,21427700000000,78.5,9.6,36.6,328239523,,11/25/25390,Real Estate,Annette Lerner & family,United States,Chevy Chase,Real estate,Real Estate,FALSE,Female,Lerner,Annette,6500,2/27/1930,96,1930,2,27,117.24,21427700000000,78.5,9.6,36.6,328239523,,11/25/25390,Real Estate,David Reuben,United Kingdom,London,"Investments, real estate",Real Estate,TRUE,Male,Reuben,David,6500,9/1/1938,87,1938,9,1,119.62,2827113184696,81.3,25.5,30.6,66834405,,11/25/25390,Real Estate,Radovan Vitek,Switzerland,Crans Montana,Real estate,Real Estate,TRUE,Male,Vitek,Radovan,6500,4/22/1971,55,1971,4,22,99.55,703082435360,83.6,10.1,28.8,8574832,,11/25/25397,Finance & Investments,Carl Bennet,Sweden,Gothenberg,Investments,Finance & Investments,TRUE,Male,Bennet,Carl,6400,8/19/1951,74,1951,8,19,110.51,530832908738,82.5,27.9,49.1,10285453,,11/25/25397,Sports,Stephen Bisciotti,United States,Hobe Sound,"Staffing, Baltimore Ravens",Sports,TRUE,Male,Bisciotti,Stephen,6400,4/10/1960,66,1960,4,10,117.24,21427700000000,78.5,9.6,36.6,328239523,,11/25/25397,Finance & Investments,Stanley Druckenmiller,United States,New York,Hedge funds,Finance & Investments,TRUE,Male,Druckenmiller,Stanley,6400,6/14/1953,72,1953,6,14,117.24,21427700000000,78.5,9.6,36.6,328239523,,11/25/25397,Healthcare,Jian Jun,China,Beijing,Biomedical products,Healthcare,TRUE,Female,Jian,Jun,6400,11/1/1963,62,1963,11,1,125.08,19910000000000,77,9.4,59.2,1397715000,,11/25/25397,Energy,Alexei Kuzmichev,France,Paris,"Oil, banking, telecom",Energy,TRUE,Male,Kuzmichev,Alexei,6400,10/15/1962,63,1962,10,15,110.05,2715518274227,82.5,24.2,60.7,67059887,,11/25/25397,Finance & Investments,Luis Carlos Sarmiento,Colombia,Bogota,Banking,Finance & Investments,TRUE,Male,Sarmiento,Luis Carlos,6400,1/27/1933,93,1933,1,27,140.95,323802808108,77.1,14.4,71.2,50339443,,11/25/25397,Logistics,Dennis Washington,United States,Missoula,"Construction, mining",Logistics,TRUE,Male,Washington,Dennis,6400,7/27/1934,91,1934,7,27,117.24,21427700000000,78.5,9.6,36.6,328239523,,11/25/25405,Construction & Engineering,Anthony Bamford & family,United Kingdom,Gloucestershire,Construction equipment,Construction & Engineering,FALSE,Male,Bamford,Anthony,6300,10/23/1945,80,1945,10,23,119.62,2827113184696,81.3,25.5,30.6,66834405,,11/25/25405,Energy,Gao Jifan & family,China,Changzhou,Solar equipment,Energy,TRUE,Male,Gao,Jifan,6300,1/1/1965,61,1965,1,1,125.08,19910000000000,77,9.4,59.2,1397715000,,11/25/25405,Finance & Investments,John Grayken,United Kingdom,London,Private equity,Finance & Investments,TRUE,Male,Grayken,John,6300,6/1/1956,69,1956,6,1,119.62,2827113184696,81.3,25.5,30.6,66834405,,11/25/25405,Healthcare,Alain Merieux & family,France,Lyon,Pharmaceuticals,Healthcare,FALSE,Male,Merieux,Alain,6300,1/1/1938,88,1938,1,1,110.05,2715518274227,82.5,24.2,60.7,67059887,,11/25/25405,Energy,Wang Yusuo & family,China,Langfang,Natural gas distribution,Energy,TRUE,Male,Wang,Yusuo,6300,3/11/1964,62,1964,3,11,125.08,19910000000000,77,9.4,59.2,1397715000,,11/25/25405,Manufacturing,Stef Wertheimer & family,Israel,Tel Aviv,Metalworking tools,Manufacturing,TRUE,Male,Wertheimer,Stef,6300,7/16/1926,99,1926,7,16,108.15,395098666122,82.8,23.1,25.3,9053300,,11/25/25411,Food & Beverage,Maria Asuncion Aramburuzabala & family,Mexico,Mexico City,"Beer, investments",Food & Beverage,FALSE,Female,Aramburuzabala,Maria Asuncion,6200,5/2/1963,63,1963,5,2,141.54,1258286717125,75,13.1,55.1,126014024,,11/25/25411,Diversified,Gustaf Douglas,Sweden,Stockholm,Investments,Diversified,TRUE,Male,Douglas,Gustaf,6200,3/3/1938,88,1938,3,3,110.51,530832908738,82.5,27.9,49.1,10285453,,11/25/25411,Service,Frits Goldschmeding,Netherlands,Amsterdam,Temp agency,Service,TRUE,Male,Goldschmeding,Frits,6200,8/2/1933,92,1933,8,2,115.91,909070395161,81.8,23,41.2,17332850,,11/25/25411,Food & Beverage,Lin Muqin & family,China,Shenzhen,Beverages,Food & Beverage,TRUE,Male,Lin,Muqin,6200,1/1/1964,62,1964,1,1,125.08,19910000000000,77,9.4,59.2,1397715000,,11/25/25411,Manufacturing,Ruan Liping,China,Ningbo,Power strips,Manufacturing,TRUE,Male,Ruan,Liping,6200,1/1/1964,62,1964,1,1,125.08,19910000000000,77,9.4,59.2,1397715000,,11/25/25411,Manufacturing,Ruan Xueping,China,Ningbo,Power strip,Manufacturing,TRUE,Male,Ruan,Xueping,6200,1/1/1972,54,1972,1,1,125.08,19910000000000,77,9.4,59.2,1397715000,,11/25/25411,Finance & Investments,Michal Solowow,Poland,Kielce,Investments,Finance & Investments,TRUE,Male,Solowow,Michal,6200,7/11/1962,63,1962,7,11,114.11,592164400688,77.6,17.4,40.8,37970874,,11/25/25418,Diversified,Mike Adenuga,Nigeria,Lagos,"Telecom, oil",Diversified,TRUE,Male,Adenuga,Mike,6100,4/29/1953,73,1953,4,29,267.51,448120428859,54.3,1.5,34.8,200963599,,11/25/25418,Finance & Investments,Tom Gores,United States,Beverly Hills,Private equity,Finance & Investments,TRUE,Male,Gores,Tom,6100,7/31/1964,61,1964,7,31,117.24,21427700000000,78.5,9.6,36.6,328239523,,11/25/25418,Fashion & Retail,Michael Herz,Germany,Hamburg,Coffee,Fashion & Retail,FALSE,Male,Herz,Michael,6100,9/28/1943,82,1943,9,28,112.85,3845630030824,80.9,11.5,48.8,83132799,,11/25/25418,Fashion & Retail,Wolfgang Herz,Germany,Hamburg,Coffee,Fashion & Retail,FALSE,Male,Herz,Wolfgang,6100,1/1/1951,75,1951,1,1,112.85,3845630030824,80.9,11.5,48.8,83132799,,11/25/25425,Metals & Mining,Alexander Abramov,Russia,Moscow,"Steel, mining",Metals & Mining,TRUE,Male,Abramov,Alexander,6000,2/20/1959,67,1959,2,20,180.75,1699876578871,72.7,11.4,46.2,144373535,,11/25/25425,Real Estate,Neil Bluhm,United States,Chicago,Real estate,Real Estate,TRUE,Male,Bluhm,Neil,6000,1/12/1938,88,1938,1,12,117.24,21427700000000,78.5,9.6,36.6,328239523,,11/25/25425,Fashion & Retail,Alain Bouchard,Canada,Montreal,Convinience stores,Fashion & Retail,TRUE,Male,Bouchard,Alain,6000,2/18/1949,77,1949,2,18,116.76,1736425629520,81.9,12.8,24.5,36991981,,11/25/25425,Technology,Jay Chaudhry,United States,Reno,Security software,Technology,TRUE,Male,Chaudhry,Jay,6000,8/26/1959,66,1959,8,26,117.24,21427700000000,78.5,9.6,36.6,328239523,,11/25/25425,Fashion & Retail,Gopikishan Damani,India,Mumbai,"Retail, investments",Fashion & Retail,TRUE,Male,Damani,Gopikishan,6000,1/1/1958,68,1958,1,1,180.44,2611000000000,69.4,11.2,49.7,1366417754,,11/25/25425,Diversified,Sumet Jiaravanon,Thailand,Bangkok,Diversified,Diversified,FALSE,Male,Jiaravanon,Sumet,6000,11/2/1934,91,1934,11,2,113.27,543649976166,76.9,14.9,29.5,69625582,,11/25/25425,Finance & Investments,Frank Lowy,Israel,Tel Aviv,Investments,Finance & Investments,TRUE,Male,Lowy,Frank,6000,10/22/1930,95,1930,10,22,108.15,395098666122,82.8,23.1,25.3,9053300,,11/25/25425,Finance & Investments,Michael Milken,United States,Los Angeles,Investments,Finance & Investments,TRUE,Male,Milken,Michael,6000,7/4/1946,79,1946,7,4,117.24,21427700000000,78.5,9.6,36.6,328239523,,11/25/25425,Technology,David Steward,United States,St. Louis,IT provider,Technology,TRUE,Male,Steward,David,6000,7/2/1951,74,1951,7,2,117.24,21427700000000,78.5,9.6,36.6,328239523,,11/25/25425,Fashion & Retail,Les Wexner & family,United States,New Albany,Retail,Fashion & Retail,TRUE,Male,Wexner,Les,6000,9/8/1937,88,1937,9,8,117.24,21427700000000,78.5,9.6,36.6,328239523,,11/25/25437,Real Estate,Cai Kui,China,Chengdu,Real estate,Real Estate,TRUE,Male,Cai,Kui,5900,1/1/1963,63,1963,1,1,125.08,19910000000000,77,9.4,59.2,1397715000,,11/25/25437,Diversified,Jaran Chiaravanont,Thailand,Bangkok,Diversified,Diversified,FALSE,Male,Chiaravanont,Jaran,5900,4/1/1930,96,1930,4,1,113.27,543649976166,76.9,14.9,29.5,69625582,,11/25/25437,Finance & Investments,Andreas Halvorsen,United States,Darien,Hedge funds,Finance & Investments,TRUE,Male,Halvorsen,Andreas,5900,4/23/1961,65,1961,4,23,117.24,21427700000000,78.5,9.6,36.6,328239523,,11/25/25437,Finance & Investments,Antony Ressler,United States,Los Angeles,Finance,Finance & Investments,TRUE,Male,Ressler,Antony,5900,10/12/1960,65,1960,10,12,117.24,21427700000000,78.5,9.6,36.6,328239523,,11/25/25437,Food & Beverage,Tsai Eng-meng,China,Shanghai,"Food, beverages",Food & Beverage,FALSE,Male,Tsai,Eng-meng,5900,1/15/1957,69,1957,1,15,125.08,19910000000000,77,9.4,59.2,1397715000,,11/25/25442,Finance & Investments,Josh Harris,United States,Miami,Private equity,Finance & Investments,TRUE,Male,Harris,Josh,5800,12/29/1964,61,1964,12,29,117.24,21427700000000,78.5,9.6,36.6,328239523,,11/25/25442,Healthcare,Niels Peter Louis-Hansen,Denmark,Humlebaek,Medical devices,Healthcare,FALSE,Male,Louis-Hansen,Niels Peter,5800,10/25/1947,78,1947,10,25,110.35,348078018464,81,32.4,23.8,5818553,,11/25/25442,Healthcare,Patrick Soon-Shiong,United States,Los Angeles,Pharmaceuticals,Healthcare,TRUE,Male,Soon-Shiong,Patrick,5800,7/29/1952,73,1952,7,29,117.24,21427700000000,78.5,9.6,36.6,328239523,,11/25/25445,Metals & Mining,Rinat Akhmetov,Ukraine,Donetsk,"Steel, coal",Metals & Mining,TRUE,Male,Akhmetov,Rinat,5700,9/21/1966,59,1966,9,21,281.66,153781069118,71.6,20.1,45.2,44385155,,11/25/25445,Healthcare,John Brown,United States,Atlanta,Medical equipment,Healthcare,TRUE,Male,Brown,John,5700,9/15/1934,91,1934,9,15,117.24,21427700000000,78.5,9.6,36.6,328239523,,11/25/25445,Energy,Arthur Irving,Canada,Saint John,Oil,Energy,FALSE,Male,Irving,Arthur,5700,1/1/1930,96,1930,1,1,116.76,1736425629520,81.9,12.8,24.5,36991981,,11/25/25445,Real Estate,Fredrik Lundberg,Sweden,Stockholm,"Real estate, investments",Real Estate,FALSE,Male,Lundberg,Fredrik,5700,8/5/1951,74,1951,8,5,110.51,530832908738,82.5,27.9,49.1,10285453,,11/25/25445,Construction & Engineering,Thomas Schmidheiny,Switzerland,Jona,Cement,Construction & Engineering,FALSE,Male,Schmidheiny,Thomas,5700,12/17/1945,80,1945,12,17,99.55,703082435360,83.6,10.1,28.8,8574832,,11/25/25445,Finance & Investments,Daniel Ziff,United States,New York,Investments,Finance & Investments,FALSE,Male,Ziff,Daniel,5700,11/2/1971,54,1971,11,2,117.24,21427700000000,78.5,9.6,36.6,328239523,,11/25/25445,Finance & Investments,Dirk Ziff,United States,North Palm Beach,Investments,Finance & Investments,FALSE,Male,Ziff,Dirk,5700,4/1/1964,62,1964,4,1,117.24,21427700000000,78.5,9.6,36.6,328239523,,11/25/25445,Finance & Investments,Robert Ziff,United States,New York,Investments,Finance & Investments,FALSE,Male,Ziff,Robert,5700,8/12/1966,59,1966,8,12,117.24,21427700000000,78.5,9.6,36.6,328239523,,11/25/25455,Energy,Ray Lee Hunt,United States,Dallas,"Oil, real estate",Energy,FALSE,Male,Hunt,Ray Lee,5600,4/6/1943,83,1943,4,6,117.24,21427700000000,78.5,9.6,36.6,328239523,,11/25/25455,Logistics,Lai Meisong,China,Shanghai,Package delivery,Logistics,TRUE,Male,Lai,Meisong,5600,12/1/1970,55,1970,12,1,125.08,19910000000000,77,9.4,59.2,1397715000,,11/25/25455,Automotive,Vikram Lal & family,India,Delhi,Motorcycles,Automotive,FALSE,Male,Lal,Vikram,5600,3/5/1942,84,1942,3,5,180.44,2611000000000,69.4,11.2,49.7,1366417754,,11/25/25455,Finance & Investments,Ken Langone,United States,Sands Point,Investments,Finance & Investments,TRUE,Male,Langone,Ken,5600,9/16/1935,90,1935,9,16,117.24,21427700000000,78.5,9.6,36.6,328239523,,11/25/25455,Healthcare,Li Ge,China,Shanghai,Pharmaceutical ingredients,Healthcare,TRUE,Male,Li,Ge,5600,1/1/1967,59,1967,1,1,125.08,19910000000000,77,9.4,59.2,1397715000,,11/25/25455,Finance & Investments,Karen Pritzker,United States,Branford,"Hotels, investments",Finance & Investments,FALSE,Female,Pritzker,Karen,5600,1/7/1958,68,1958,1,7,117.24,21427700000000,78.5,9.6,36.6,328239523,,11/25/25455,Service,Robert Rowling,United States,Dallas,"Hotels, investments",Service,FALSE,Male,Rowling,Robert,5600,9/26/1953,72,1953,9,26,117.24,21427700000000,78.5,9.6,36.6,328239523,,11/25/25455,Gambling & Casinos,Teddy Sagi,Israel,Tel Aviv,Gambling software,Gambling & Casinos,TRUE,Male,Sagi,Teddy,5600,11/1/1971,54,1971,11,1,108.15,395098666122,82.8,23.1,25.3,9053300,,11/25/25455,Healthcare,Seo Jung-jin,South Korea,Seoul,Biotech,Healthcare,TRUE,Male,Seo,Jung-jin,5600,10/23/1957,68,1957,10,23,115.16,2029000000000,82.6,15.6,33.2,51709098,,11/25/25455,Automotive,Wu Jianshu,China,Ningbo,Auto parts,Automotive,TRUE,Male,Wu,Jianshu,5600,1/1/1964,62,1964,1,1,125.08,19910000000000,77,9.4,59.2,1397715000,,11/25/25466,Service,Micky Arison,United States,Bal Harbour,Carnival Cruises,Service,FALSE,Male,Arison,Micky,5500,6/29/1949,76,1949,6,29,117.24,21427700000000,78.5,9.6,36.6,328239523,,11/25/25466,Media & Entertainment,James Chambers,United States,Palisades,"Media, automotive",Media & Entertainment,FALSE,Male,Chambers,James,5500,4/12/1957,69,1957,4,12,117.24,21427700000000,78.5,9.6,36.6,328239523,,11/25/25466,Technology,John Collison,United States,San Francisco,Payments software,Technology,TRUE,Male,Collison,John,5500,8/6/1990,35,1990,8,6,117.24,21427700000000,78.5,9.6,36.6,328239523,,11/25/25466,Technology,Patrick Collison,United States,San Francisco,Payment software,Technology,TRUE,Male,Collison,Patrick,5500,9/9/1988,37,1988,9,9,117.24,21427700000000,78.5,9.6,36.6,328239523,,11/25/25466,Manufacturing,Archie Aldis Emmerson & family,United States,Redding,"Timberland, lumber mills",Manufacturing,TRUE,Male,Emmerson,Archie Aldis,5500,4/10/1929,97,1929,4,10,117.24,21427700000000,78.5,9.6,36.6,328239523,,11/25/25466,Automotive,Piero Ferrari,Italy,Modena,Automobiles,Automotive,FALSE,Male,Ferrari,Piero,5500,5/22/1945,81,1945,5,22,110.62,2001244392042,82.9,24.3,59.1,60297396,,11/25/25466,Automotive,Dan Friedkin,United States,Houston,Toyota dealerships,Automotive,FALSE,Male,Friedkin,Dan,5500,2/27/1965,61,1965,2,27,117.24,21427700000000,78.5,9.6,36.6,328239523,,11/25/25466,Diversified,James Irving,Canada,Saint John,Diversified,Diversified,FALSE,Male,Irving,James,5500,3/20/1928,98,1928,3,20,116.76,1736425629520,81.9,12.8,24.5,36991981,,11/25/25466,Manufacturing,Jiang Weiping & family,China,Chengdu,Chemicals,Manufacturing,TRUE,Male,Jiang,Weiping,5500,3/1/1955,71,1955,3,1,125.08,19910000000000,77,9.4,59.2,1397715000,,11/25/25466,Healthcare,Wolfgang Marguerre & family,Germany,Heidelberg,Pharmaceuticals,Healthcare,TRUE,Male,Marguerre,Wolfgang,5500,6/4/1941,84,1941,6,4,112.85,3845630030824,80.9,11.5,48.8,83132799,,11/25/25466,Finance & Investments,Ludwig Merckle,Germany,Ulm,Pharmaceuticals,Finance & Investments,FALSE,Male,Merckle,Ludwig,5500,1/1/1965,61,1965,1,1,112.85,3845630030824,80.9,11.5,48.8,83132799,,11/25/25466,Manufacturing,Mitchell Rales,United States,Potomac,"Manufacturing, investments",Manufacturing,TRUE,Male,Rales,Mitchell,5500,8/21/1956,69,1956,8,21,117.24,21427700000000,78.5,9.6,36.6,328239523,,11/25/25466,Media & Entertainment,Katharine Rayner,United States,East Hampton,"Media, automotive",Media & Entertainment,FALSE,Female,Rayner,Katharine,5500,1/12/1945,81,1945,1,12,117.24,21427700000000,78.5,9.6,36.6,328239523,,11/25/25466,Finance & Investments,Paul Singer,United States,New York,Hedge funds,Finance & Investments,TRUE,Male,Singer,Paul,5500,8/22/1944,81,1944,8,22,117.24,21427700000000,78.5,9.6,36.6,328239523,,11/25/25466,Healthcare,Sergio Stevanato & family,Italy,Venice,Medical packaging,Healthcare,TRUE,Male,Stevanato,Sergio,5500,3/20/1943,83,1943,3,20,110.62,2001244392042,82.9,24.3,59.1,60297396,,11/25/25466,Media & Entertainment,Margaretta Taylor,United States,Southampton,"Media, automotive",Media & Entertainment,FALSE,Female,Taylor,Margaretta,5500,4/15/1942,84,1942,4,15,117.24,21427700000000,78.5,9.6,36.6,328239523,,11/25/25466,Technology,Richard White,Australia,Sydney,Software,Technology,TRUE,Male,White,Richard,5500,4/1/1955,71,1955,4,1,119.8,1392680589329,82.7,23,47.4,25766605,,11/25/25466,Diversified,Zhao Yan,China,Beijing,Biotech,Diversified,TRUE,Female,Zhao,Yan,5500,1/1/1967,59,1967,1,1,125.08,19910000000000,77,9.4,59.2,1397715000,,11/25/25486,Fashion & Retail,Patrizio Bertelli,Italy,Milan,Luxury goods,Fashion & Retail,TRUE,Male,Bertelli,Patrizio,5400,1/1/1946,80,1946,1,1,110.62,2001244392042,82.9,24.3,59.1,60297396,,11/25/25486,Manufacturing,Mahendra Choksi & family,India,Mumbai,Paints,Manufacturing,FALSE,Male,Choksi,Mahendra,5400,4/19/1941,85,1941,4,19,180.44,2611000000000,69.4,11.2,49.7,1366417754,,11/25/25486,Finance & Investments,Mat Ishbia,United States,Bloomfield Hills,Mortgage lender,Finance & Investments,FALSE,Male,Ishbia,Mat,5400,1/6/1980,46,1980,1,6,117.24,21427700000000,78.5,9.6,36.6,328239523,,11/25/25486,Technology,Leo Koguan,Singapore,Singapore,IT provider,Technology,TRUE,Male,Koguan,Leo,5400,2/15/1955,71,1955,2,15,114.41,372062527489,83.1,13.1,21,5703569,,11/25/25486,Diversified,Miao Hangen,China,Suzhou,"Textiles, petrochemicals",Diversified,TRUE,Male,Miao,Hangen,5400,1/1/1965,61,1965,1,1,125.08,19910000000000,77,9.4,59.2,1397715000,,11/25/25486,Manufacturing,Michael Pieper,Switzerland,Lucerne,Kitchen appliances,Manufacturing,TRUE,Male,Pieper,Michael,5400,2/5/1946,80,1946,2,5,99.55,703082435360,83.6,10.1,28.8,8574832,,11/25/25486,Fashion & Retail,Miuccia Prada,Italy,Milan,Luxury goods,Fashion & Retail,FALSE,Female,Prada,Miuccia,5400,5/10/1949,77,1949,5,10,110.62,2001244392042,82.9,24.3,59.1,60297396,,11/25/25486,Fashion & Retail,Wolfgang Reimann,Germany,Passau,Consumer goods,Fashion & Retail,FALSE,Male,Reimann,Wolfgang,5400,10/4/1952,73,1952,10,4,112.85,3845630030824,80.9,11.5,48.8,83132799,,11/25/25486,Fashion & Retail,Matthias Reimann-Andersen,Germany,Munich,Consumer goods,Fashion & Retail,FALSE,Male,Reimann-Andersen,Matthias,5400,3/30/1965,61,1965,3,30,112.85,3845630030824,80.9,11.5,48.8,83132799,,11/25/25486,Fashion & Retail,Stefan Reimann-Andersen,Austria,Vienna,Consumer goods,Fashion & Retail,FALSE,Male,Reimann-Andersen,Stefan,5400,7/13/1963,62,1963,7,13,118.06,446314739528,81.6,25.4,51.4,8877067,,11/25/25486,Fashion & Retail,Renate Reimann-Haas,Austria,Vienna,Consumer goods,Fashion & Retail,FALSE,Female,Reimann-Haas,Renate,5400,10/8/1951,74,1951,10,8,118.06,446314739528,81.6,25.4,51.4,8877067,,11/25/25497,Finance & Investments,Todd Boehly,United States,Darien,Finance,Finance & Investments,TRUE,Male,Boehly,Todd,5300,9/20/1973,52,1973,9,20,117.24,21427700000000,78.5,9.6,36.6,328239523,,11/25/25497,Real Estate,Rick Caruso,United States,Los Angeles,Real estate,Real Estate,TRUE,Male,Caruso,Rick,5300,1/7/1959,67,1959,1,7,117.24,21427700000000,78.5,9.6,36.6,328239523,,11/25/25497,Manufacturing,Ibrahim Erdemoglu,Turkey,Istanbul,Carpet,Manufacturing,TRUE,Male,Erdemoglu,Ibrahim,5300,9/26/1962,63,1962,9,26,234.44,754411708203,77.4,17.9,42.3,83429615,,11/25/25497,Finance & Investments,Elizabeth Johnson,United States,Boston,Fidelity,Finance & Investments,FALSE,Female,Johnson,Elizabeth,5300,5/7/1963,63,1963,5,7,117.24,21427700000000,78.5,9.6,36.6,328239523,,11/25/25497,Finance & Investments,Douglas Leone,United States,Atherton,Venture capital,Finance & Investments,TRUE,Male,Leone,Douglas,5300,7/4/1957,68,1957,7,4,117.24,21427700000000,78.5,9.6,36.6,328239523,,11/25/25497,Diversified,Prajogo Pangestu,Indonesia,Jakarta,Petrochemicals,Diversified,FALSE,Male,Pangestu,Prajogo,5300,5/13/1944,82,1944,5,13,151.18,1119190780753,71.5,10.2,30.1,270203917,,11/25/25497,Finance & Investments,Thomas Pritzker,United States,Chicago,"Hotels, investments",Finance & Investments,FALSE,Male,Pritzker,Thomas,5300,6/6/1950,75,1950,6,6,117.24,21427700000000,78.5,9.6,36.6,328239523,,11/25/25497,Food & Beverage,Lynda Resnick,United States,Beverly Hills,Agriculture,Food & Beverage,TRUE,Female,Resnick,Lynda,5300,1/2/1943,83,1943,1,2,117.24,21427700000000,78.5,9.6,36.6,328239523,,11/25/25497,Food & Beverage,Stewart Resnick,United States,Beverly Hills,Agriculture,Food & Beverage,TRUE,Male,Resnick,Stewart,5300,12/24/1936,89,1936,12,24,117.24,21427700000000,78.5,9.6,36.6,328239523,,11/25/25497,Service,Gary Rollins,United States,Atlanta,Pest control,Service,FALSE,Male,Rollins,Gary,5300,8/30/1944,81,1944,8,30,117.24,21427700000000,78.5,9.6,36.6,328239523,,11/25/25497,Finance & Investments,Mark Walter,United States,Chicago,"Finance, asset management",Finance & Investments,TRUE,Male,Walter,Mark,5300,5/22/1960,66,1960,5,22,117.24,21427700000000,78.5,9.6,36.6,328239523,,11/25/25497,Manufacturing,Ronald Wanek,United States,Saint Petersburg,Furniture,Manufacturing,TRUE,Male,Wanek,Ronald,5300,5/19/1941,85,1941,5,19,117.24,21427700000000,78.5,9.6,36.6,328239523,,11/25/25497,Food & Beverage,Erich Wesjohann & family,Germany,Visbek,Poultry genetics,Food & Beverage,TRUE,Male,Wesjohann,Erich,5300,6/2/1945,80,1945,6,2,112.85,3845630030824,80.9,11.5,48.8,83132799,,11/25/25497,Fashion & Retail,M.A. Yusuff Ali,United Arab Emirates,Abu Dhabi,Retail,Fashion & Retail,TRUE,Male,Yusuff Ali,M.A.,5300,11/15/1955,70,1955,11,15,114.52,421142267938,77.8,0.1,15.9,9770529,,11/25/25,,,,,,,,,,,,,,,,,,,,,,,,,,,,,,,,,,,,,,,,,,,,,,,,,,,,,,,,,,,,,,,,,,,,,,,,,,,,,,,,,,,,,,,,,,,,,,,,,,,,,,,,,,,,,,,,,,,,,,,,,,,,,,,,,,,,,,,,,,,,,,,,